1, 峨 眉 山 月 半 輪 秋 ， 影 入 平 羌 江 水 流
1, 夜 發 清 溪 向 三 峽 ， 思 君 不 見 下 渝 州
1, 我 在 巴 東 三 峽 時 ， 西 看 明 月 憶 峨 眉
1, 月 出 峨 眉 照 滄 海 ， 與 人 萬 里 長 相 隨
1, 黃 鶴 樓 前 月 華 白 ， 此 中 忽 見 峨 眉 客
1, 長 安 大 道 橫 九 天 ， 峨 眉 山 月 照 秦 川
1, 黃 金 獅 子 乘 高 座 ， 白 玉 麈 尾 談 重 玄
1, 我 似 浮 雲 殢 吳 越 ， 君 逢 聖 主 游 丹 闕
1, 一 振 高 名 滿 帝 都 ， 歸 時 還 弄 峨 眉 月
1, 二 龍 爭 戰 決 雌 雄 ， 赤 壁 樓 船 掃 地 空
1, 烈 火 張 天 照 雲 海 ， 周 瑜 于 此 破 曹 公
1, 君 去 滄 江 望 澄 碧 ， 鯨 鯢 唐 突 留 餘 跡
1, 一 一 書 來 報 故 人 ， 我 欲 因 之 壯 心 魄
1, 憶 昔 嬌 小 姿 ， 春 心 亦 自 持
1, 誰 知 嫁 商 賈 ， 令 人 卻 愁 苦
1, 自 從 為 夫 妻 ， 何 曾 在 鄉 土
1, 去 年 下 揚 州 ， 相 送 黃 鶴 樓
1, 眼 看 帆 去 遠 ， 心 逐 江 水 流
1, 只 言 期 一 載 ， 誰 謂 曆 三 秋
1, 使 妾 腸 欲 斷 ， 恨 君 情 悠 悠
1, 東 家 西 舍 同 時 發 ， 北 去 南 來 不 逾 月
1, 未 知 行 李 游 何 方 ， 作 個 音 書 能 斷 絕
1, 適 來 往 南 浦 ， 欲 問 西 江 船
1, 一 種 為 人 妻 ， 獨 自 多 悲 淒
1, 對 鏡 便 垂 淚 ， 逢 人 只 欲 啼
1, 不 如 輕 薄 兒 ， 旦 暮 長 相 隨
1, 悔 作 商 人 婦 ， 青 春 長 別 離
1, 如 今 正 好 同 歡 樂 ， 君 去 容 華 誰 得 知
1, 一 鶴 東 飛 過 滄 海 ， 放 心 散 漫 知 何 在
1, 仙 人 浩 歌 望 我 來 ， 應 攀 玉 樹 長 相 待
1, 堯 舜 之 事 不 足 驚 ， 自 餘 囂 囂 直 可 輕
1, 巨 鼇 莫 戴 三 山 去 ， 我 欲 蓬 萊 頂 上 行
1, 清 晨 鳴 天 鼓 ， 飆 欻 騰 雙 龍
1, 弄 電 不 輟 手 ， 行 雲 本 無 蹤
1, 幾 時 入 少 室 ， 王 母 應 相 逢
1, 清 溪 清 我 心 ， 水 色 異 諸 水
1, 借 問 新 安 江 ， 見 底 何 如 此
1, 人 行 明 鏡 中 ， 鳥 度 屏 風 裏
1, 向 晚 猩 猩 啼 ， 空 悲 遠 遊 子
1, 我 吟 謝 脁 詩 上 語 ， 朔 風 颯 颯 吹 飛 雨
1, 謝 脁 已 沒 青 山 空 ， 後 來 繼 之 有 殷 公
1, 文 章 彪 炳 光 陸 離 ， 應 是 素 娥 玉 女 之 所 為
1, 輕 如 松 花 落 金 粉 ， 濃 似 苔 錦 含 碧 滋
1, 遠 山 積 翠 橫 海 島 ， 殘 霞 飛 丹 映 江 草
1, 凝 毫 采 掇 花 露 容 ， 幾 年 功 成 奪 天 造
1, 故 人 贈 我 我 不 違 ， 著 令 山 水 含 清 暉
1, 頓 驚 謝 康 樂 ， 詩 興 生 我 衣
1, 襟 前 林 壑 斂 暝 色 ， 袖 上 雲 霞 收 夕 霏
1, 群 仙 長 歎 驚 此 物 ， 千 崖 萬 嶺 相 縈 鬱
1, 身 騎 白 鹿 行 飄 颻 ， 手 翳 紫 芝 笑 披 拂
1, 瑤 台 雪 花 數 千 點 ， 片 片 吹 落 春 風 香
1, 為 君 持 此 淩 蒼 蒼 ， 上 朝 三 十 六 玉 皇
1, 下 窺 夫 子 不 可 及 ， 矯 首 相 思 空 斷 腸
1, 大 鵬 飛 兮 振 八 裔 ， 中 天 摧 兮 力 不 濟
1, 餘 風 激 兮 萬 世 ， 遊 扶 桑 兮 掛 石 袂
1, 後 人 得 之 傳 此 ， 仲 尼 亡 兮 誰 為 出 涕
1, 君 為 女 蘿 草 ， 妾 作 兔 絲 花
1, 輕 條 不 自 引 ， 為 逐 春 風 斜
1, 百 丈 托 遠 松 ， 纏 綿 成 一 家
1, 女 蘿 發 馨 香 ， 兔 絲 斷 人 腸
1, 枝 枝 相 糾 結 ， 葉 葉 競 飄 揚
1, 生 子 不 知 根 ， 因 誰 共 芬 芳
1, 中 巢 雙 翡 翠 ， 上 宿 紫 鴛 鴦
1, 若 識 二 草 心 ， 海 潮 亦 可 量
1, 苦 竹 嶺 頭 秋 月 輝 ， 苦 竹 南 枝 鷓 鴣 飛
1, 嫁 得 燕 山 胡 雁 婿 ， 欲 銜 我 向 雁 門 歸
1, 山 雞 翟 雉 來 相 勸 ， 南 禽 多 被 北 禽 欺
1, 紫 塞 嚴 霜 如 劍 戟 ， 蒼 梧 欲 巢 難 背 違
1, 太 古 曆 陽 郡 ， 化 為 洪 川 在
1, 江 山 猶 郁 盤 ， 龍 虎 秘 光 彩
1, 蓄 泄 數 千 載 ， 風 雲 何 霮 z w
1, 特 生 勤 將 軍 ， 神 力 百 夫 倍
1, 少 年 上 人 號 懷 素 ， 草 書 天 下 稱 獨 步
1, 墨 池 飛 出 北 溟 魚 ， 筆 鋒 殺 盡 中 山 兔
1, 八 月 九 月 天 氣 涼 ， 酒 徒 詞 客 滿 高 堂
1, 箋 麻 素 絹 排 數 廂 ， 宣 州 石 硯 墨 色 光
1, 吾 師 醉 後 倚 繩 床 ， 須 臾 掃 盡 數 千 張
1, 起 來 向 壁 不 停 手 ， 一 行 數 字 大 如 鬥
1, 怳 怳 如 聞 神 鬼 驚 ， 時 時 只 見 龍 蛇 走
1, 左 盤 右 蹙 如 驚 電 ， 狀 同 楚 漢 相 攻 戰
1, 湖 南 七 郡 凡 幾 家 ， 家 家 屏 障 書 題 遍
1, 王 逸 少 ， 張 伯 英 ， 古 來 幾 許 浪 得 名
1, 張 顛 老 死 不 足 數 ， 我 師 此 義 不 師 古
1, 古 來 萬 事 貴 天 生 ， 何 必 要 公 孫 大 娘 渾 脫 舞
1, 君 誇 通 塘 好 ， 通 塘 勝 耶 溪
1, 通 塘 在 何 處 ， 遠 在 尋 陽 西
1, 石 門 中 斷 平 湖 出 ， 百 丈 金 潭 照 雲 日
1, 何 處 滄 浪 垂 釣 翁 ， 鼓 棹 漁 歌 趣 非 一
1, 相 逢 不 相 識 ， 出 沒 繞 通 塘
1, 浦 邊 清 水 明 素 足 ， 別 有 浣 沙 吳 女 郎
1, 行 盡 綠 潭 潭 轉 幽 ， 疑 是 武 陵 春 碧 流
1, 秦 人 雞 犬 桃 花 裏 ， 將 比 通 塘 渠 見 羞
1, 通 塘 不 忍 別 ， 十 去 九 遲 回
1, 偶 逢 佳 境 心 已 醉 ， 忽 有 一 鳥 從 天 來
1, 月 出 青 山 送 行 子 ， 四 邊 苦 竹 秋 聲 起
1, 梁 鴻 德 耀 會 稽 日 ， 寧 知 此 中 樂 事 多
1, 吾 愛 孟 夫 子 ， 風 流 天 下 聞
1, 紅 顏 棄 軒 冕 ， 白 首 臥 松 雲
1, 醉 月 頻 中 聖 ， 迷 花 不 事 君
1, 高 山 安 可 仰 ， 徒 此 揖 清 芬
1, 結 髮 未 識 事 ， 所 交 盡 豪 雄
1, 卻 秦 不 受 賞 ， 擊 晉 寧 為 功
1, 小 節 豈 足 言 ， 退 耕 舂 陵 東
1, 歸 來 無 產 業 ， 生 事 如 轉 蓬
1, 彈 劍 徒 激 昂 ， 出 門 悲 路 窮
1, 吾 兄 青 雲 士 ， 然 諾 聞 諸 公
1, 所 以 陳 片 言 ， 片 言 貴 情 通
1, 棣 華 倘 不 接 ， 甘 與 秋 草 同
1, 朔 雪 落 吳 天 ， 從 風 渡 溟 渤
1, 海 樹 成 陽 春 ， 江 沙 浩 明 月
1, 興 從 剡 溪 起 ， 思 繞 梁 園 發
1, 寄 君 郢 中 歌 ， 曲 罷 心 斷 絕
1, 白 田 見 楚 老 ， 歌 詠 徐 安 宜
1, 清 風 動 百 里 ， 惠 化 聞 京 師
1, 浮 人 若 雲 歸 ， 耕 種 滿 郊 岐
1, 川 光 淨 麥 隴 ， 日 色 明 桑 枝
1, 訟 息 但 長 嘯 ， 賓 來 或 解 頤
1, 青 橙 拂 戶 牖 ， 白 水 流 園 池
1, 遊 子 滯 安 邑 ， 懷 恩 未 忍 辭
1, 翳 君 樹 桃 李 ， 歲 晚 托 深 期
1, 海 鳥 知 天 風 ， 竄 身 魯 門 東
1, 臨 觴 不 能 飲 ， 矯 翼 思 淩 空
1, 歸 飛 未 忍 去 ， 流 淚 謝 鴛 鴻
1, 遠 海 動 風 色 ， 吹 愁 落 天 涯
1, 南 星 變 大 火 ， 熱 氣 餘 丹 霞
1, 光 景 不 可 回 ， 六 龍 轉 天 車
1, 荊 人 泣 美 玉 ， 魯 叟 悲 匏 瓜
1, 功 業 若 夢 裏 ， 撫 琴 發 長 嗟
1, 裴 生 信 英 邁 ， 屈 起 多 才 華
1, 曆 抵 海 岱 豪 ， 結 交 魯 朱 家
1, 複 攜 兩 少 女 ， 豔 色 驚 荷 葩
1, 窮 溟 出 寶 貝 ， 大 澤 饒 龍 蛇
1, 明 主 倘 見 收 ， 煙 霞 路 非 賒
1, 時 命 若 不 會 ， 歸 應 煉 丹 砂
1, 君 子 枉 清 盼 ， 不 知 東 走 迷
1, 離 家 來 幾 月 ， 絡 緯 鳴 中 閨
1, 桃 李 君 不 言 ， 攀 花 願 成 蹊
1, 那 能 吐 芳 信 ， 惠 好 相 招 攜
1, 我 有 結 綠 珍 ， 久 藏 濁 水 泥
1, 時 人 棄 此 物 ， 乃 與 燕 瑉 齊
1, 遼 東 慚 白 豕 ， 楚 客 羞 山 雞
1, 徒 有 獻 芹 心 ， 終 流 泣 玉 啼
1, 只 應 自 索 漠 ， 留 舌 示 山 妻
1, 範 宰 不 買 名 ， 弦 歌 對 前 楹
1, 為 邦 默 自 化 ， 日 覺 冰 壺 清
1, 百 里 雞 犬 靜 ， 千 廬 機 杼 鳴
1, 浮 人 少 蕩 析 ， 愛 客 多 逢 迎
1, 遊 子 睹 嘉 政 ， 因 之 聽 頌 聲
1, 皎 皎 鸞 鳳 姿 ， 飄 飄 神 仙 氣
1, 清 風 佐 鳴 琴 ， 寂 寞 道 為 貴
1, 一 見 過 所 聞 ， 操 持 難 與 群
1, 毫 揮 魯 邑 訟 ， 目 送 瀛 洲 雲
1, 我 隱 屠 釣 下 ， 爾 當 玉 石 分
1, 無 由 接 高 論 ， 空 此 仰 清 芬
1, 去 年 別 我 向 何 處 ， 有 人 傳 道 游 江 東
1, 謂 言 掛 席 度 滄 海 ， 卻 來 應 是 無 長 風
1, 潮 水 還 歸 海 ， 流 人 卻 到 吳
1, 相 逢 問 愁 苦 ， 淚 盡 日 南 珠
1, 全 勝 若 耶 好 ， 莫 道 此 行 難
1, 猿 嘯 千 溪 合 ， 松 風 五 月 寒
1, 他 年 一 攜 手 ， 搖 艇 入 新 安
1, 周 子 橫 山 隱 ， 開 門 臨 城 隅
1, 連 峰 入 戶 牖 ， 勝 概 淩 方 壺
1, 時 作 白 紵 詞 ， 放 歌 丹 陽 湖
1, 水 色 傲 溟 渤 ， 川 光 秀 菰 蒲
1, 當 其 得 意 時 ， 心 與 天 壤 俱
1, 閑 雲 隨 舒 卷 ， 安 識 身 有 無
1, 羽 化 如 可 作 ， 相 攜 上 清 都
1, 秋 坐 金 張 館 ， 繁 陰 晝 不 開
1, 空 煙 迷 雨 色 ， 蕭 颯 望 中 來
1, 翳 翳 昏 墊 苦 ， 沉 沉 憂 恨 催
1, 清 秋 何 以 慰 ， 白 酒 盈 吾 杯
1, 吟 詠 思 管 樂 ， 此 人 已 成 灰
1, 獨 酌 聊 自 勉 ， 誰 貴 經 綸 才
1, 彈 劍 謝 公 子 ， 無 魚 良 可 哀
1, 苦 雨 思 白 日 ， 浮 雲 何 由 卷
1, 秋 霖 劇 倒 井 ， 昏 霧 橫 絕 巘
1, 欲 往 咫 尺 途 ， 遂 成 山 川 限
1, 潈 潈 奔 溜 聞 ， 浩 浩 驚 波 轉
1, 泥 沙 塞 中 途 ， 牛 馬 不 可 辨
1, 饑 從 漂 母 食 ， 閑 綴 羽 陵 簡
1, 園 家 逢 秋 蔬 ， 藜 藿 不 滿 眼
1, 蠨 蛸 結 思 幽 ， 蟋 蟀 傷 褊 淺
1, 廚 灶 無 青 煙 ， 刀 機 生 綠 蘚
1, 投 箸 解 鷫 鸘 ， 換 酒 醉 北 堂
1, 何 時 黃 金 盤 ， 一 斛 薦 檳 榔
1, 功 成 拂 衣 去 ， 搖 曳 滄 洲 傍
1, 谷 口 鄭 子 真 ， 躬 耕 在 岩 石
1, 高 名 動 京 師 ， 天 下 皆 籍 籍
1, 斯 人 竟 不 起 ， 雲 臥 從 所 適
1, 苟 無 濟 代 心 ， 獨 善 亦 何 益
1, 惟 君 家 世 者 ， 偃 息 逢 休 明
1, 談 天 信 浩 蕩 ， 說 劍 紛 縱 橫
1, 謝 公 不 徒 然 ， 起 來 為 蒼 生
1, 且 複 歸 碧 山 ， 安 能 戀 金 闕
1, 舊 宅 樵 漁 地 ， 蓬 蒿 已 應 沒
1, 卻 顧 女 幾 峰 ， 胡 顏 見 雲 月
1, 徒 為 風 塵 苦 ， 一 官 已 白 須
1, 氣 同 萬 里 合 ， 訪 我 來 瓊 都
1, 披 雲 睹 青 天 ， 捫 虱 話 良 圖
1, 留 侯 將 綺 裏 ， 出 處 未 雲 殊
1, 終 與 安 社 稷 ， 功 成 去 五 湖
1, 太 華 生 長 松 ， 亭 亭 淩 霜 雪
1, 桃 李 賣 陽 豔 ， 路 人 行 且 迷
1, 春 光 掃 地 盡 ， 碧 葉 成 黃 泥
1, 願 君 學 長 松 ， 慎 勿 作 桃 李
1, 受 屈 不 改 心 ， 然 後 知 君 子
1, 見 君 乘 驄 馬 ， 知 上 太 山 道
1, 此 地 果 摧 輪 ， 全 身 以 為 寶
1, 我 如 豐 年 玉 ， 棄 置 秋 田 草
1, 但 勖 冰 壺 心 ， 無 為 歎 衰 老
1, 我 有 吳 越 曲 ， 無 人 知 此 音
1, 未 誇 觀 濤 作 ， 空 鬱 釣 鼇 心
1, 舉 手 謝 東 海 ， 虛 行 歸 故 林
1, 有 時 忽 惆 悵 ， 匡 坐 至 夜 分
1, 平 明 空 嘯 吒 ， 思 欲 解 世 紛
1, 心 隨 長 風 去 ， 吹 散 萬 里 雲
1, 羞 作 濟 南 生 ， 九 十 誦 古 文
1, 不 然 拂 劍 起 ， 沙 漠 收 奇 勳
1, 老 死 阡 陌 間 ， 何 因 揚 清 芬
1, 夫 子 今 管 樂 ， 英 才 冠 三 軍
1, 漢 道 昔 雲 季 ， 群 雄 方 戰 爭
1, 霸 圖 各 未 立 ， 割 據 資 豪 英
1, 赤 伏 起 頹 運 ， 臥 龍 得 孔 明
1, 當 其 南 陽 時 ， 隴 畝 躬 自 耕
1, 魚 水 三 顧 合 ， 風 雲 四 海 生
1, 武 侯 立 岷 蜀 ， 壯 志 吞 咸 京
1, 何 人 先 見 許 ， 但 有 崔 州 平
1, 餘 亦 草 間 人 ， 頗 懷 拯 物 情
1, 晚 途 值 子 玉 ， 華 髮 同 衰 榮
1, 毋 令 管 與 鮑 ， 千 載 獨 知 名
1, 將 軍 少 年 出 武 威 ， 入 掌 銀 台 護 紫 微
1, 平 明 拂 劍 朝 天 去 ， 薄 暮 垂 鞭 醉 酒 歸
1, 愛 子 臨 風 吹 玉 笛 ， 美 人 向 月 舞 羅 衣
1, 疇 昔 雄 豪 如 夢 裏 ， 相 逢 且 欲 醉 春 暉
1, 少 年 落 魄 楚 漢 間 ， 風 塵 蕭 瑟 多 苦 顏
1, 自 言 管 葛 竟 誰 許 ， 長 籲 莫 錯 還 閉 關
1, 一 朝 君 王 垂 拂 拭 ， 剖 心 輸 丹 雪 胸 臆 ， 忽 蒙 白 日 回 景 光 ， 直 上 青 雲 生 羽 翼 ， 幸 陪 鸞 輦 出 鴻 都 ， 身 騎 飛 龍 天 馬 駒
1, 王 公 大 人 借 顏 色 ， 金 璋 紫 綬 來 相 趨
1, 待 吾 盡 節 報 明 主 ， 然 後 相 攜 臥 白 雲
1, 漢 帝 長 楊 苑 ， 誇 胡 羽 獵 歸
1, 子 雲 叨 侍 從 ， 獻 賦 有 光 輝
1, 激 賞 搖 天 筆 ， 承 恩 賜 禦 衣
1, 逢 君 奏 明 主 ， 他 日 共 翻 飛
1, 朝 見 裴 叔 則 ， 朗 如 行 玉 山 ， 黃 河 落 天 走 東 海 ， 萬 里 寫 入 胸 懷 間
1, 身 騎 白 黿 不 敢 度 ， 金 高 南 山 買 君 顧
1, 裴 回 六 合 無 相 知 ， 飄 若 浮 雲 且 西 去
1, 黃 河 二 尺 鯉 ， 本 在 孟 津 居
1, 故 人 東 海 客 ， 一 見 借 吹 噓
1, 風 濤 倘 相 見 ， 更 欲 淩 昆 墟
1, 天 為 國 家 孕 英 才 ， 森 森 矛 戟 擁 靈 台
1, 浩 蕩 深 謀 噴 江 海 ， 縱 橫 逸 氣 走 風 雷
1, 丈 夫 立 身 有 如 此 ， 一 呼 三 軍 皆 披 靡
1, 衛 青 謾 作 大 將 軍 ， 白 起 真 成 一 豎 子
1, 嗟 予 沉 迷 ， 猖 獗 已 久
1, 五 十 知 非 ， 古 人 嘗 有
1, 立 言 補 過 ， 庶 存 不 朽
1, 月 出 致 譏 ， 貽 愧 皓 首
1, 感 悟 遂 晚 ， 事 往 日 遷
1, 白 璧 何 辜 ， 青 蠅 屢 前
1, 群 輕 折 軸 ， 下 沉 黃 泉
1, 眾 毛 飛 骨 ， 上 淩 青 天
1, 萋 斐 暗 成 ， 貝 錦 粲 然
1, 泥 沙 聚 埃 ， 珠 玉 不 鮮
1, 洪 焰 爍 山 ， 發 自 纖 煙
1, 蒼 波 蕩 日 ， 起 於 微 涓
1, 拾 塵 掇 蜂 ， 疑 聖 猜 賢
1, 哀 哉 悲 夫 ， 誰 察 予 之 貞 堅
1, 彼 婦 人 之 倡 狂 ， 不 如 鵲 之 強 強
1, 彼 婦 人 之 淫 昏 ， 不 如 鶉 之 奔 奔
1, 坦 蕩 君 子 ， 無 悅 簧 言
1, 擢 發 續 罪 ， 罪 乃 孔 多
1, 傾 海 流 惡 ， 惡 無 以 過
1, 人 生 實 難 ， 逢 此 織 羅
1, 積 毀 銷 金 ， 沉 憂 作 歌
1, 妲 己 滅 紂 ， 褒 女 惑 周
1, 天 維 蕩 覆 ， 職 此 之 由
1, 漢 祖 呂 氏 ， 食 其 在 傍
1, 秦 皇 太 后 ， 毐 亦 淫 荒
1, 螮 蝀 作 昏 ， 遂 掩 太 陽
1, 萬 乘 尚 爾 ， 匹 夫 何 傷
1, 辭 殫 意 窮 ， 心 切 理 直
1, 如 或 妄 談 ， 昊 天 是 殛
1, 子 野 善 聽 ， 離 婁 至 明
1, 不 我 遐 棄 ， 庶 昭 忠 誠
1, 白 鶴 飛 天 書 ， 南 荊 訪 高 士
1, 五 雲 在 峴 山 ， 果 得 參 寥 子
1, 骯 髒 辭 故 園 ， 昂 藏 入 君 門
1, 天 子 分 玉 帛 ， 百 官 接 話 言
1, 毫 墨 時 灑 落 ， 探 玄 有 奇 作
1, 著 論 窮 天 人 ， 千 春 秘 麟 閣
1, 長 揖 不 受 官 ， 拂 衣 歸 林 巒
1, 余 亦 去 金 馬 ， 藤 蘿 同 所 歡
1, 朝 飲 蒼 梧 泉 ， 夕 棲 碧 海 煙
1, 寧 知 鸞 鳳 意 ， 遠 托 椅 桐 前
1, 慕 藺 豈 曩 古 ， 攀 嵇 是 當 年
1, 愧 非 黃 石 老 ， 安 識 子 房 賢
1, 功 業 嗟 落 日 ， 容 華 棄 徂 川
1, 一 語 已 道 意 ， 三 山 期 著 鞭
1, 蹉 跎 人 間 世 ， 寥 落 壺 中 天
1, 獨 見 游 物 祖 ， 探 元 窮 化 先
1, 何 當 共 攜 手 ， 相 與 排 冥 筌
1, 天 開 青 雲 器 ， 日 為 蒼 生 憂
1, 小 邑 且 割 雞 ， 大 刀 佇 烹 牛
1, 雷 聲 動 四 境 ， 惠 與 清 漳 流
1, 弦 歌 詠 唐 堯 ， 脫 落 隱 簪 組
1, 心 和 得 天 真 ， 風 俗 猶 太 古
1, 牛 羊 散 阡 陌 ， 夜 寢 不 扃 戶
1, 問 此 何 以 然 ， 賢 人 宰 吾 土
1, 舉 邑 樹 桃 李 ， 垂 陰 亦 流 芬
1, 河 堤 繞 綠 水 ， 桑 柘 連 青 雲
1, 繰 絲 鳴 機 杼 ， 百 里 聲 相 聞
1, 訟 息 鳥 下 階 ， 高 臥 披 道 帙
1, 蒲 鞭 掛 簷 枝 ， 示 恥 無 撲 抶
1, 琴 清 月 當 戶 ， 人 寂 風 入 室
1, 長 嘯 一 無 言 ， 陶 然 上 皇 逸
1, 白 玉 壺 冰 水 ， 壺 中 見 底 清
1, 清 光 洞 毫 髮 ， 皎 潔 照 群 情
1, 趙 北 美 佳 政 ， 燕 南 播 高 名
1, 過 客 覽 行 謠 ， 因 之 誦 德 聲
1, 大 音 自 成 曲 ， 但 奏 無 弦 琴
1, 釣 水 路 非 遠 ， 連 鼇 意 何 深
1, 終 期 龍 伯 國 ， 與 爾 相 招 尋
1, 河 東 郭 有 道 ， 於 世 若 浮 雲
1, 盛 德 無 我 位 ， 清 光 獨 映 君
1, 恥 將 雞 並 食 ， 長 與 鳳 為 群
1, 一 擊 九 千 仞 ， 相 期 淩 紫 氛
1, 一 身 竟 無 托 ， 遠 與 孤 蓬 征
1, 千 里 失 所 依 ， 複 將 落 葉 並
1, 欲 獻 濟 時 策 ， 此 心 誰 見 明
1, 君 王 制 六 合 ， 海 塞 無 交 兵
1, 壯 士 伏 草 間 ， 沉 憂 亂 縱 橫
1, 飄 飄 不 得 意 ， 昨 發 南 都 城
1, 紫 燕 櫪 下 嘶 ， 青 萍 匣 中 鳴
1, 投 軀 寄 天 下 ， 長 嘯 尋 豪 英
1, 恥 學 琅 琊 人 ， 龍 蟠 事 躬 耕
1, 富 貴 吾 自 取 ， 建 功 及 春 榮
1, 我 願 執 爾 手 ， 爾 方 達 我 情
1, 抱 子 弄 白 雲 ， 琴 歌 發 清 聲
1, 臨 別 意 難 盡 ， 各 希 存 令 名
1, 淮 水 不 絕 濤 瀾 高 ， 盛 德 未 泯 生 英 髦
1, 知 君 先 負 廟 堂 器 ， 今 日 還 須 贈 寶 刀
1, 明 主 訪 賢 逸 ， 雲 泉 今 已 空
1, 二 盧 竟 不 起 ， 萬 乘 高 其 風
1, 河 上 喜 相 得 ， 壺 中 趣 每 同
1, 滄 州 即 此 地 ， 觀 化 遊 無 窮
1, 水 落 海 上 清 ， 鼇 背 睹 方 蓬
1, 韓 信 在 淮 陰 ， 少 年 相 欺 淩
1, 屈 體 若 無 骨 ， 壯 心 有 所 憑
1, 一 遭 龍 顏 君 ， 嘯 吒 從 此 興
1, 千 金 答 漂 母 ， 萬 古 共 嗟 稱
1, 而 我 竟 何 為 ， 寒 苦 坐 相 仍
1, 長 風 入 短 袂 ， 兩 手 如 懷 冰
1, 故 友 不 相 恤 ， 新 交 寧 見 矜
1, 摧 殘 檻 中 虎 ， 羈 絏 鞲 上 鷹
1, 何 時 騰 風 雲 ， 搏 擊 申 所 能
1, 洛 陽 因 劇 孟 ， 托 宿 話 胸 襟
1, 但 仰 山 嶽 秀 ， 不 知 江 海 深
1, 長 安 複 攜 手 ， 再 顧 重 千 金
1, 君 乃 輶 軒 佐 ， 予 叨 翰 墨 林
1, 高 風 摧 秀 木 ， 虛 彈 落 驚 禽
1, 不 取 回 舟 興 ， 而 來 命 駕 尋
1, 扶 搖 應 借 力 ， 桃 李 願 成 陰
1, 笑 吐 張 儀 舌 ， 愁 為 莊 舄 吟
1, 誰 憐 明 月 夜 ， 腸 斷 聽 秋 砧
1, 銀 鞍 紫 鞚 照 雲 日 ， 左 顧 右 盼 生 光 輝
1, 是 時 僕 在 金 門 裏 ， 待 詔 公 車 謁 天 子
1, 長 揖 蒙 垂 國 士 恩 ， 壯 心 剖 出 酬 知 己
1, 一 別 蹉 跎 朝 市 間 ， 青 雲 之 交 不 可 攀
1, 倘 其 公 子 重 回 顧 ， 何 必 侯 嬴 長 抱 關
1, 二 室 淩 青 天 ， 三 花 含 紫 煙
1, 中 有 蓬 海 客 ， 宛 疑 麻 姑 仙
1, 道 在 喧 莫 染 ， 跡 高 想 已 綿
1, 時 餐 金 鵝 蕊 ， 屢 讀 青 苔 篇
1, 下 瓢 酌 潁 水 ， 舞 鶴 來 伊 川
1, 還 歸 空 山 上 ， 獨 拂 秋 霞 眠
1, 蘿 月 掛 朝 鏡 ， 松 風 鳴 夜 弦
1, 潛 光 隱 嵩 嶽 ， 煉 魄 棲 雲 幄
1, 霓 裳 何 飄 颻 ， 鳳 吹 轉 綿 邈
1, 願 同 西 王 母 ， 下 顧 東 方 朔
1, 紫 書 倘 可 傳 ， 銘 骨 誓 相 學
1, 陶 令 辭 彭 澤 ， 梁 鴻 入 會 稽
1, 我 尋 高 士 傳 ， 君 與 古 人 齊
1, 不 知 楊 伯 起 ， 早 晚 向 關 西
1, 大 鵬 一 日 同 風 起 ， 摶 搖 直 上 九 萬 里
1, 假 令 風 歇 時 下 來 ， 猶 能 簸 卻 滄 溟 水
1, 世 人 見 我 恒 殊 調 ， 聞 餘 大 言 皆 冷 笑
1, 宣 父 猶 能 畏 後 生 ， 丈 夫 未 可 輕 年 少
1, 列 子 居 鄭 圃 ， 不 將 眾 庶 分
1, 革 侯 遁 南 浦 ， 常 恐 楚 人 聞
1, 抱 甕 灌 秋 蔬 ， 心 閒 遊 天 雲
1, 每 將 瓜 田 叟 ， 耕 種 漢 水 濆
1, 井 無 桔 槔 事 ， 門 絕 刺 繡 文
1, 長 揖 二 千 石 ， 遠 辭 百 里 君
1, 斯 為 真 隱 者 ， 吾 黨 慕 清 芬
1, 木 落 識 歲 秋 ， 瓶 冰 知 天 寒
1, 桂 枝 日 已 綠 ， 拂 雪 淩 雲 端
1, 弱 齡 接 光 景 ， 矯 翼 攀 鴻 鸞
1, 投 分 三 十 載 ， 榮 枯 同 所 歡
1, 長 籲 望 青 雲 ， 鑷 白 坐 相 看
1, 秋 顏 入 曉 鏡 ， 壯 發 凋 危 冠
1, 時 來 極 天 人 ， 道 在 豈 吟 歎
1, 樂 毅 方 適 趙 ， 蘇 秦 初 說 韓
1, 卷 舒 固 在 我 ， 何 事 空 摧 殘
1, 嘗 高 謝 太 傅 ， 攜 妓 東 山 門
1, 楚 舞 醉 碧 雲 ， 吳 歌 斷 清 猿
1, 暫 因 蒼 生 起 ， 談 笑 安 黎 元
1, 餘 亦 愛 此 人 ， 丹 霄 冀 飛 翻
1, 遭 逢 聖 明 主 ， 敢 進 興 亡 言
1, 白 璧 竟 何 辜 ， 青 蠅 遂 成 冤
1, 猛 犬 吠 九 關 ， 殺 人 憤 精 魂
1, 皇 穹 雪 冤 枉 ， 白 日 開 氛 昏
1, 泰 階 得 夔 龍 ， 桃 李 滿 中 原
1, 倒 海 索 明 月 ， 淩 山 采 芳 蓀
1, 愧 無 橫 草 功 ， 虛 負 雨 露 恩
1, 跡 謝 雲 台 閣 ， 心 隨 天 馬 轅
1, 夫 子 王 佐 才 ， 而 今 複 誰 論
1, 層 飆 振 六 翮 ， 不 日 思 騰 騫
1, 我 縱 五 湖 棹 ， 煙 濤 恣 崩 奔
1, 彼 希 客 星 隱 ， 弱 植 不 足 援
1, 千 里 一 回 首 ， 萬 里 一 長 歌
1, 黃 鶴 不 復 來 ， 清 風 愁 奈 何
1, 舟 浮 瀟 湘 月 ， 山 倒 洞 庭 波
1, 投 汨 笑 古 人 ， 臨 濠 得 天 和
1, 閒 時 田 畝 中 ， 搔 背 牧 雞 鵝
1, 別 離 解 相 訪 ， 應 在 武 陵 多
1, 昔 為 大 堤 客 ， 曾 上 山 公 樓
1, 開 窗 碧 嶂 滿 ， 拂 鏡 滄 江 流
1, 此 地 別 夫 子 ， 今 來 思 舊 遊
1, 朱 顏 君 未 老 ， 白 髮 我 先 秋
1, 壯 志 恐 蹉 跎 ， 功 名 若 雲 浮
1, 歸 心 結 遠 夢 ， 落 日 懸 春 愁
1, 空 思 羊 叔 子 ， 墮 淚 峴 山 頭
1, 昨 夜 梁 園 裏 ， 弟 寒 兄 不 知
1, 庭 前 看 玉 樹 ， 腸 斷 憶 連 枝
1, 清 水 見 白 石 ， 仙 人 識 青 童
1, 安 陵 蓋 夫 子 ， 十 歲 與 天 通
1, 能 令 二 千 石 ， 撫 背 驚 神 聰
1, 揮 毫 贈 新 詩 ， 高 價 掩 山 東
1, 至 今 平 原 客 ， 感 激 慕 清 風
1, 學 道 北 海 仙 ， 傳 書 蕊 珠 宮
1, 丹 田 了 玉 闕 ， 白 日 思 雲 空
1, 為 我 草 真 籙 ， 天 人 慚 妙 工
1, 七 元 洞 豁 落 ， 八 角 輝 星 虹
1, 三 災 蕩 璿 璣 ， 蛟 龍 翼 微 躬
1, 舉 手 謝 天 地 ， 虛 無 齊 始 終
1, 下 笑 世 上 士 ， 沉 魂 北 羅 酆
1, 昔 日 萬 乘 墳 ， 今 成 一 科 蓬
1, 贈 言 若 可 重 ， 實 此 輕 華 嵩
1, 胡 雁 拂 海 翼 ， 翱 翔 鳴 素 秋
1, 驚 雲 辭 沙 朔 ， 飄 蕩 迷 河 洲
1, 有 如 飛 蓬 人 ， 去 逐 萬 里 遊
1, 登 高 望 浮 雲 ， 仿 佛 如 舊 丘
1, 日 從 海 傍 沒 ， 水 向 天 邊 流
1, 長 嘯 倚 孤 劍 ， 目 極 心 悠 悠
1, 仲 尼 七 十 說 ， 曆 聘 莫 見 收
1, 魯 連 逃 千 金 ， 珪 組 豈 可 酬
1, 時 哉 苟 不 會 ， 草 木 為 我 儔
1, 希 君 同 攜 手 ， 長 往 南 山 幽
1, 綠 驥 本 天 馬 ， 素 非 伏 櫪 駒
1, 長 嘶 向 清 風 ， 倏 忽 淩 九 區
1, 何 言 西 北 至 ， 卻 走 東 南 隅
1, 世 道 有 翻 覆 ， 前 期 難 豫 圖
1, 希 君 一 翦 拂 ， 猶 可 騁 中 衢
1, 賢 人 當 重 寄 ， 天 子 借 高 名
1, 巨 海 一 邊 靜 ， 長 江 萬 里 清
1, 應 須 救 趙 策 ， 未 肯 棄 侯 嬴
1, 魚 目 高 泰 山 ， 不 如 一 璵 璠
1, 賢 甥 即 明 月 ， 聲 價 動 天 門
1, 能 成 吾 宅 相 ， 不 減 魏 陽 元
1, 自 顧 寡 籌 略 ， 功 名 安 所 存
1, 五 木 思 一 擲 ， 如 繩 系 窮 猿
1, 櫪 中 駿 馬 空 ， 堂 上 醉 人 喧
1, 聞 君 隴 西 行 ， 使 我 驚 心 魂
1, 與 爾 共 飄 颻 ， 雲 天 各 飛 翻
1, 江 水 流 或 卷 ， 此 心 難 具 論
1, 貧 家 羞 好 客 ， 語 拙 覺 辭 繁
1, 三 朝 空 錯 莫 ， 對 飯 卻 慚 冤
1, 自 笑 我 非 夫 ， 生 事 多 契 闊
1, 蓄 積 萬 古 憤 ， 向 誰 得 開 豁
1, 天 地 一 浮 雲 ， 此 身 乃 毫 末
1, 忽 見 無 端 倪 ， 太 虛 可 包 括
1, 肝 膽 不 楚 越 ， 山 河 亦 衾 裯
1, 雲 龍 若 相 從 ， 明 主 會 見 收
1, 成 功 解 相 訪 ， 溪 水 桃 花 流
1, 翡 翠 黃 金 縷 ， 繡 成 歌 舞 衣
1, 若 無 雲 間 月 ， 誰 可 比 光 輝
1, 秀 色 一 如 此 ， 多 為 眾 女 譏
1, 君 恩 移 昔 愛 ， 失 寵 秋 風 歸
1, 愁 苦 不 窺 鄰 ， 泣 上 流 黃 機
1, 天 寒 素 手 冷 ， 夜 長 燭 複 微
1, 猶 是 可 憐 人 ， 容 華 世 中 稀
1, 向 君 發 皓 齒 ， 顧 我 莫 相 違
1, 泰 伯 讓 天 下 ， 仲 雍 揚 波 濤
1, 清 風 蕩 萬 古 ， 跡 與 星 辰 高
1, 開 吳 食 東 溟 ， 陸 氏 世 英 髦
1, 多 君 秉 古 節 ， 嶽 立 冠 人 曹
1, 風 流 少 年 時 ， 京 洛 事 遊 遨
1, 腰 間 延 陵 劍 ， 玉 帶 明 珠 袍
1, 我 昔 鬥 雞 徒 ， 連 延 五 陵 豪
1, 君 開 萬 叢 人 ， 鞍 馬 皆 辟 易
1, 告 急 清 憲 台 ， 脫 餘 北 門 厄
1, 間 宰 江 陽 邑 ， 翦 棘 樹 蘭 芳
1, 城 門 何 肅 穆 ， 五 月 飛 秋 霜
1, 好 鳥 集 珍 木 ， 高 才 列 華 堂
1, 時 從 府 中 歸 ， 絲 管 儼 成 行
1, 但 苦 隔 遠 道 ， 無 由 共 銜 觴
1, 江 北 荷 花 開 ， 江 南 楊 梅 熟
1, 正 好 飲 酒 時 ， 懷 賢 在 心 目
1, 多 沽 新 豐 醁 ， 滿 載 剡 溪 船
1, 中 途 不 遇 人 ， 直 到 爾 門 前
1, 大 笑 同 一 醉 ， 取 樂 平 生 年
