3, 青 白 二 小 蛇 ， 幽 姿 可 時 睹
3, 如 絲 氣 或 上 ， 爛 熳 為 雲 雨
3, 山 頭 到 山 下 ， 鑿 井 不 盡 土
3, 取 供 十 方 僧 ， 香 美 勝 牛 乳
3, 北 風 起 寒 文 ， 弱 藻 舒 翠 縷
3, 明 涵 客 衣 淨 ， 細 蕩 林 影 趣
3, 何 當 宅 下 流 ， 餘 潤 通 藥 圃
3, 死 別 已 吞 聲 ， 生 別 常 惻 惻
3, 江 南 瘴 癘 地 ， 逐 客 無 消 息
3, 故 人 入 我 夢 ， 明 我 長 相 憶
3, 恐 非 平 生 魂 ， 路 遠 不 可 測
3, 魂 來 楓 葉 青 ， 魂 返 關 塞 黑
3, 君 今 在 羅 網 ， 何 以 有 羽 翼
3, 落 月 滿 屋 樑 ， 猶 疑 照 顏 色
3, 水 深 波 浪 闊 ， 無 使 皎 龍 得
3, 浮 雲 終 日 行 ， 遊 子 久 不 至
3, 告 歸 常 局 促 ， 苦 道 來 不 易
3, 江 湖 多 風 波 ， 舟 楫 恐 失 墜
3, 出 門 搔 白 首 ， 若 負 平 生 志
3, 冠 蓋 滿 京 華 ， 斯 人 獨 憔 悴
3, 孰 雲 網 恢 恢 ， 將 老 身 反 累
3, 千 秋 萬 歲 名 ， 寂 寞 身 後 事
3, 天 臺 隔 三 江 ， 風 浪 無 晨 暮
3, 鄭 公 縱 得 歸 ， 老 病 不 識 路
3, 昔 如 水 上 鷗 ， 今 如 罝 中 兔
3, 山 鬼 獨 一 腳 ， 蝮 蛇 長 如 樹
3, 呼 號 傍 孤 城 ， 歲 月 誰 與 度
3, 從 來 禦 魑 魅 ， 多 為 才 名 誤
3, 夫 子 嵇 阮 流 ， 更 被 時 俗 惡
3, 海 隅 微 小 吏 ， 眼 暗 發 垂 素
3, 黃 帽 映 青 袍 ， 非 供 折 腰 具
3, 平 生 一 杯 酒 ， 見 我 故 人 遇
3, 相 望 無 所 成 ， 乾 坤 莽 回 互
3, 蟄 龍 三 冬 臥 ， 老 鶴 萬 里 心
3, 嵇 康 不 得 死 ， 孔 明 有 知 音
3, 又 如 壟 底 松 ， 用 舍 在 所 尋
3, 大 哉 霜 雪 幹 ， 歲 久 為 枯 林
3, 昔 者 龐 德 公 ， 未 曾 入 州 府
3, 襄 陽 耆 舊 間 ， 處 士 節 獨 苦
3, 豈 無 濟 時 策 ， 終 竟 畏 羅 罟
3, 林 茂 鳥 有 歸 ， 水 深 魚 知 聚
3, 舉 家 依 鹿 門 ， 劉 表 焉 得 取
3, 我 今 日 夜 憂 ， 諸 弟 各 異 方
3, 避 寇 一 分 散 ， 饑 寒 永 相 望
3, 豈 無 柴 門 歸 ， 欲 出 畏 虎 狼
3, 仰 看 雲 中 雁 ， 禽 鳥 亦 有 行
3, 蓬 生 非 無 根 ， 漂 蕩 隨 高 風
3, 天 寒 落 萬 里 ， 不 復 歸 本 叢
3, 客 子 念 故 宅 ， 三 年 門 巷 空
3, 悵 望 但 烽 火 ， 戎 車 滿 關 東
3, 生 涯 能 幾 何 ， 常 在 羈 旅 中
3, 昔 在 洛 陽 時 ， 親 友 相 追 攀
3, 煙 塵 阻 長 河 ， 樹 羽 成 皋 間
3, 回 首 載 酒 地 ， 豈 無 一 日 還
3, 丈 夫 貴 壯 健 ， 慘 戚 非 朱 顏
3, 朔 風 飄 胡 雁 ， 慘 澹 帶 砂 礫
3, 長 林 何 蕭 蕭 ， 秋 草 萋 更 碧
3, 北 裏 富 熏 天 ， 高 樓 夜 吹 笛
3, 焉 知 南 鄰 客 ， 九 月 猶 絺 綌
3, 長 陵 銳 頭 兒 ， 出 獵 待 明 發
3, 騂 弓 金 爪 鏑 ， 白 馬 蹴 微 雪
3, 歸 來 懸 兩 狼 ， 門 戶 有 旌 節
3, 漆 有 用 而 割 ， 膏 以 明 自 煎
3, 蘭 摧 白 露 下 ， 桂 折 秋 風 前
3, 府 中 羅 舊 尹 ， 沙 道 尚 依 然
3, 赫 赫 蕭 京 兆 ， 今 為 時 所 憐
3, 猛 虎 憑 其 威 ， 往 往 遭 急 縛
3, 雷 吼 徒 咆 哮 ， 枝 撐 已 在 腳
3, 忽 看 皮 寢 處 ， 無 複 睛 閃 爍
3, 人 有 甚 於 斯 ， 足 以 勸 元 惡
3, 共 指 親 戚 大 ， 緦 麻 百 夫 行
3, 送 者 各 有 死 ， 不 須 羨 其 強
3, 君 看 束 練 去 ， 亦 得 歸 山 岡
3, 天 用 莫 如 龍 ， 有 時 系 扶 桑
3, 頓 轡 海 徒 湧 ， 神 人 身 更 長
3, 性 命 苟 不 存 ， 英 雄 徒 自 強
3, 吞 聲 勿 複 道 ， 真 宰 意 茫 茫
3, 地 用 莫 如 馬 ， 無 良 複 誰 記
3, 此 日 千 里 鳴 ， 追 風 可 君 意
3, 不 雜 蹄 齧 間 ， 逍 遙 有 能 事
3, 陶 潛 避 俗 翁 ， 未 必 能 達 道
3, 觀 其 著 詩 集 ， 頗 亦 恨 枯 槁
3, 達 生 豈 是 足 ， 默 識 蓋 不 早
3, 有 子 賢 與 愚 ， 何 其 掛 懷 抱
3, 賀 公 雅 吳 語 ， 在 位 常 清 狂
3, 上 疏 乞 骸 骨 ， 黃 冠 歸 故 鄉
3, 爽 氣 不 可 致 ， 斯 人 今 則 亡
3, 山 陰 一 茅 宇 ， 江 海 日 淒 涼
3, 賦 詩 何 必 多 ， 往 往 淩 鮑 謝
3, 清 江 空 舊 魚 ， 春 雨 餘 甘 蔗
3, 每 望 東 南 雲 ， 令 人 幾 悲 吒
3, 戚 戚 去 故 里 ， 悠 悠 赴 交 河
3, 公 家 有 程 期 ， 亡 命 嬰 禍 羅
3, 君 已 富 土 境 ， 開 邊 一 何 多
3, 棄 絕 父 母 恩 ， 吞 聲 行 負 戈
3, 出 門 日 已 遠 ， 不 受 徒 旅 欺
3, 骨 肉 恩 豈 斷 ， 男 兒 死 無 時
3, 捷 下 萬 仞 岡 ， 俯 身 試 搴 旗
3, 磨 刀 嗚 咽 水 ， 水 赤 刃 傷 手
3, 欲 輕 腸 斷 聲 ， 心 緒 亂 已 久
3, 丈 夫 誓 許 國 ， 憤 惋 複 何 有
3, 功 名 圖 騏 驎 ， 戰 骨 當 速 朽
3, 送 徒 既 有 長 ， 遠 戍 亦 有 身
3, 生 死 向 前 去 ， 不 勞 吏 怒 嗔
3, 路 逢 相 識 人 ， 附 書 與 六 親
3, 哀 哉 兩 決 絕 ， 不 復 同 苦 辛
3, 軍 中 異 苦 樂 ， 主 將 甯 盡 聞
3, 隔 河 見 胡 騎 ， 倏 忽 數 百 群
3, 我 始 為 奴 僕 ， 幾 時 樹 功 勳
3, 挽 弓 當 挽 強 ， 用 箭 當 用 長
3, 射 人 先 射 馬 ， 擒 賊 先 擒 王
3, 殺 人 亦 有 限 ， 列 國 自 有 疆
3, 苟 能 制 侵 陵 ， 豈 在 多 殺 傷
3, 驅 馬 天 雨 雪 ， 軍 行 入 高 山
3, 徑 危 抱 寒 石 ， 指 落 曾 冰 間
3, 浮 雲 暮 南 征 ， 可 望 不 可 攀
3, 單 于 寇 我 壘 ， 百 里 風 塵 昏
3, 雄 劍 四 五 動 ， 彼 軍 為 我 奔
3, 虜 其 名 王 歸 ， 系 頸 授 轅 門
3, 潛 身 備 行 列 ， 一 勝 何 足 論
3, 從 軍 十 年 餘 ， 能 無 分 寸 功
3, 眾 人 貴 苟 得 ， 欲 語 羞 雷 同
3, 中 原 有 鬥 爭 ， 況 在 狄 與 戎
3, 丈 夫 四 方 志 ， 安 可 辭 固 窮
3, 戰 伐 有 功 業 ， 焉 能 守 舊 丘
3, 召 募 赴 薊 門 ， 軍 動 不 可 留
3, 千 金 買 馬 鞭 ， 百 金 裝 刀 頭
3, 閭 裏 送 我 行 ， 親 戚 擁 道 周
3, 斑 白 居 上 列 ， 酒 酣 進 庶 羞
3, 少 年 別 有 贈 ， 含 笑 看 吳 鉤
3, 朝 進 東 門 營 ， 暮 上 河 陽 橋
3, 落 日 照 大 旗 ， 馬 鳴 風 蕭 蕭
3, 平 沙 列 萬 幕 ， 部 伍 各 見 招
3, 悲 笳 數 聲 動 ， 壯 士 慘 不 驕
3, 借 問 大 將 誰 ， 恐 是 霍 嫖 姚
3, 古 人 重 守 邊 ， 今 人 重 高 勳
3, 豈 知 英 雄 主 ， 出 師 亙 長 雲
3, 六 合 已 一 家 ， 四 夷 且 孤 軍
3, 遂 使 貔 虎 士 ， 奮 身 勇 所 聞
3, 拔 劍 擊 大 荒 ， 日 收 胡 馬 群
3, 誓 開 玄 冥 北 ， 持 以 奉 吾 君
3, 獻 凱 日 繼 踵 ， 兩 蕃 靜 無 虞
3, 雲 帆 轉 遼 海 ， 粳 稻 來 東 吳
3, 越 羅 與 楚 練 ， 照 耀 輿 台 軀
3, 主 將 位 益 崇 ， 氣 驕 淩 上 都
3, 邊 人 不 敢 議 ， 議 者 死 路 衢
3, 我 本 良 家 子 ， 出 師 亦 多 門
3, 將 驕 益 愁 思 ， 身 貴 不 足 論
3, 躍 馬 二 十 年 ， 恐 辜 明 主 恩
3, 坐 見 幽 州 騎 ， 長 驅 河 洛 昏
3, 中 夜 間 道 歸 ， 故 里 但 空 村
3, 百 川 日 東 流 ， 客 去 亦 不 息
3, 我 生 苦 漂 蕩 ， 何 時 有 終 極
3, 贊 公 釋 門 老 ， 放 逐 來 上 國
3, 還 為 世 塵 嬰 ， 頗 帶 憔 悴 色
3, 楊 枝 晨 在 手 ， 豆 子 雨 已 熟
3, 是 身 如 浮 雲 ， 安 可 限 南 北
3, 異 縣 逢 舊 友 ， 初 忻 寫 胸 臆
3, 天 長 關 塞 寒 ， 歲 暮 饑 凍 逼
3, 野 風 吹 征 衣 ， 欲 別 向 曛 黑
3, 古 來 聚 散 地 ， 宿 昔 長 荊 棘
3, 相 看 俱 衰 年 ， 出 處 各 努 力
3, 青 溪 合 冥 莫 ， 神 物 有 顯 晦
3, 龍 依 積 水 蟠 ， 窟 壓 萬 丈 內
3, 局 步 淩 垠 堮 ， 側 身 下 煙 靄
3, 前 臨 洪 濤 寬 ， 卻 立 蒼 石 大
3, 山 色 一 徑 盡 ， 崖 絕 兩 壁 對
3, 削 成 根 虛 無 ， 倒 影 垂 澹 瀩
3, 黑 如 灣 澴 底 ， 清 見 光 炯 碎
3, 高 蘿 成 帷 幄 ， 寒 木 累 旌 旆
3, 遠 川 曲 通 流 ， 嵌 竇 潛 泄 瀨
3, 造 幽 無 人 境 ， 發 興 自 我 輩
3, 告 歸 遺 恨 多 ， 將 老 斯 遊 最
3, 閉 藏 修 鱗 蟄 ， 出 入 巨 石 礙
3, 何 事 暑 天 過 ， 快 意 風 雨 會
3, 寒 城 朝 煙 澹 ， 山 谷 落 葉 赤
3, 陰 風 千 里 來 ， 吹 汝 江 上 宅
3, 鶤 雞 號 枉 渚 ， 日 色 傍 阡 陌
3, 哀 哀 失 木 狖 ， 矯 矯 避 弓 翮
3, 亦 知 故 鄉 樂 ， 未 敢 思 夙 昔
3, 昔 在 鳳 翔 都 ， 共 通 金 閨 籍
3, 天 子 猶 蒙 塵 ， 東 郊 暗 長 戟
3, 兵 家 忌 間 諜 ， 此 輩 常 接 跡
3, 台 中 領 舉 劾 ， 君 必 慎 剖 析
3, 不 忍 殺 無 辜 ， 所 以 分 白 黑
3, 上 官 權 許 與 ， 失 意 見 遷 斥
3, 仲 尼 甘 旅 人 ， 向 子 識 損 益
3, 余 時 忝 諍 臣 ， 丹 陛 實 咫 尺
3, 相 看 受 狼 狽 ， 至 死 難 塞 責
3, 行 邁 心 多 違 ， 出 門 無 與 適
3, 於 公 負 明 義 ， 惆 悵 頭 更 白
3, 我 衰 更 懶 拙 ， 生 事 不 自 謀
3, 無 食 問 樂 土 ， 無 衣 思 南 州
3, 漢 源 十 月 交 ， 天 氣 涼 如 秋
3, 草 木 未 黃 落 ， 況 聞 山 水 幽
3, 栗 亭 名 更 佳 ， 下 有 良 田 疇
3, 密 竹 複 冬 筍 ， 清 池 可 方 舟
3, 雖 傷 旅 寓 遠 ， 庶 遂 平 生 遊
3, 此 邦 俯 要 衝 ， 實 恐 人 事 稠
3, 應 接 非 本 性 ， 登 臨 未 銷 憂
3, 溪 谷 無 異 石 ， 塞 田 始 微 收
3, 豈 複 慰 老 夫 ， 惘 然 難 久 留
3, 日 色 隱 孤 戍 ， 烏 啼 滿 城 頭
3, 中 宵 驅 車 去 ， 飲 馬 寒 塘 流
3, 磊 落 星 月 高 ， 蒼 茫 雲 霧 浮
3, 天 寒 霜 雪 繁 ， 遊 子 有 所 之
3, 豈 但 歲 月 暮 ， 重 來 未 有 期
3, 晨 發 赤 穀 亭 ， 險 艱 方 自 茲
3, 亂 石 無 改 轍 ， 我 車 已 載 脂
3, 山 深 苦 多 風 ， 落 日 童 稚 饑
3, 悄 然 村 墟 迥 ， 煙 火 何 由 追
3, 貧 病 轉 零 落 ， 故 鄉 不 可 思
3, 常 恐 死 道 路 ， 永 為 高 人 嗤
3, 山 風 吹 遊 子 ， 縹 緲 乘 險 絕
3, 徑 摩 穹 蒼 蟠 ， 石 與 厚 地 裂
3, 修 纖 無 垠 竹 ， 嵌 空 太 始 雪
3, 威 遲 哀 壑 底 ， 徒 旅 慘 不 悅
3, 水 寒 長 冰 橫 ， 我 馬 骨 正 折
3, 生 涯 抵 弧 矢 ， 盜 賊 殊 未 滅
3, 飄 蓬 逾 三 年 ， 回 首 肝 肺 熱
3, 鹵 中 草 木 白 ， 青 者 官 鹽 煙
3, 官 作 既 有 程 ， 煮 鹽 煙 在 川
3, 汲 井 歲 榾 榾 ， 出 車 日 連 連
3, 君 子 慎 止 足 ， 小 人 苦 喧 闐
3, 我 何 良 歎 嗟 ， 物 理 固 自 然
3, 行 邁 日 悄 悄 ， 山 谷 勢 多 端
3, 雲 門 轉 絕 岸 ， 積 阻 霾 天 寒
3, 寒 硤 不 可 度 ， 我 實 衣 裳 單
3, 況 當 仲 冬 交 ， 溯 沿 增 波 瀾
3, 野 人 尋 煙 語 ， 行 子 傍 水 餐
3, 此 生 免 荷 殳 ， 未 敢 辭 路 難
3, 身 危 適 他 州 ， 勉 強 終 勞 苦
3, 嬋 娟 碧 鮮 淨 ， 蕭 摵 寒 籜 聚
3, 回 回 山 根 水 ， 冉 冉 松 上 雨
3, 泄 雲 蒙 清 晨 ， 初 日 翳 複 吐
3, 朱 甍 半 光 炯 ， 戶 牖 粲 可 數
3, 拄 策 忘 前 期 ， 出 蘿 已 亭 午
3, 冥 冥 子 規 叫 ， 微 徑 不 復 取
3, 塞 外 苦 厭 山 ， 南 行 道 彌 惡
3, 岡 巒 相 經 亙 ， 雲 水 氣 參 錯
3, 林 迥 硤 角 來 ， 天 窄 壁 面 削
3, 仰 看 日 車 側 ， 俯 恐 坤 軸 弱
3, 魑 魅 嘯 有 風 ， 霜 霰 浩 漠 漠
3, 昨 憶 逾 隴 阪 ， 高 秋 視 吳 嶽
3, 東 笑 蓮 華 卑 ， 北 知 崆 峒 薄
3, 超 然 侔 壯 觀 ， 已 謂 殷 寥 廓
3, 突 兀 猶 趁 人 ， 及 茲 歎 冥 莫
3, 細 泉 兼 輕 冰 ， 沮 洳 棧 道 濕
3, 不 辭 辛 苦 行 ， 迫 此 短 景 急
3, 石 門 雪 雲 隘 ， 古 鎮 峰 巒 集
3, 胡 馬 屯 成 皋 ， 防 虞 此 何 及
3, 嗟 爾 遠 戍 人 ， 山 寒 夜 中 泣
3, 熊 羆 哮 我 東 ， 虎 豹 號 我 西
3, 我 後 鬼 長 嘯 ， 我 前 狨 又 啼
3, 天 寒 昏 無 日 ， 山 遠 道 路 迷
3, 驅 車 石 龕 下 ， 仲 冬 見 虹 霓
3, 伐 竹 者 誰 子 ， 悲 歌 上 雲 梯
3, 為 官 采 美 箭 ， 五 歲 供 梁 齊
3, 苦 雲 直 簳 盡 ， 無 以 充 提 攜
3, 連 峰 積 長 陰 ， 白 日 遞 隱 見
3, 颼 颼 林 響 交 ， 慘 慘 石 狀 變
3, 山 分 積 草 嶺 ， 路 異 明 水 縣
3, 旅 泊 吾 道 窮 ， 衰 年 歲 時 倦
3, 卜 居 尚 百 里 ， 休 駕 投 諸 彥
3, 邑 有 佳 主 人 ， 情 如 已 會 面
3, 來 書 語 絕 妙 ， 遠 客 驚 深 眷
3, 食 蕨 不 願 餘 ， 茅 茨 眼 中 見
3, 朝 行 青 泥 上 ， 暮 在 青 泥 中
3, 不 畏 道 途 永 ， 乃 將 汩 沒 同
3, 白 馬 為 鐵 驪 ， 小 兒 成 老 翁
3, 哀 猿 透 卻 墜 ， 死 鹿 力 所 窮
3, 寄 語 北 來 人 ， 後 來 莫 匆 匆
3, 亭 亭 鳳 凰 台 ， 北 對 西 康 州
3, 西 伯 今 寂 寞 ， 鳳 聲 亦 悠 悠
3, 山 峻 路 絕 蹤 ， 石 林 氣 高 浮
3, 安 得 萬 丈 梯 ， 為 君 上 上 頭
3, 恐 有 無 母 雛 ， 饑 寒 日 啾 啾
3, 心 以 當 竹 實 ， 炯 然 無 外 求
3, 血 以 當 醴 泉 ， 豈 徒 比 清 流
3, 所 貴 王 者 瑞 ， 敢 辭 微 命 休
3, 坐 看 彩 翮 長 ， 舉 意 八 極 周
3, 自 天 銜 瑞 圖 ， 飛 下 十 二 樓
3, 圖 以 奉 至 尊 ， 鳳 以 垂 鴻 猷
3, 再 光 中 興 業 ， 一 洗 蒼 生 憂
3, 深 衷 正 為 此 ， 群 盜 何 淹 留
3, 有 客 有 客 字 子 美 ， 白 頭 亂 髮 垂 過 耳
3, 中 原 無 書 歸 不 得 ， 手 腳 凍 皴 皮 肉 死
3, 嗚 呼 一 歌 兮 歌 已 哀 ， 悲 風 為 我 從 天 來
3, 長 鑱 長 鑱 白 木 柄 ， 我 生 托 子 以 為 命
3, 黃 精 無 苗 山 雪 盛 ， 短 衣 數 挽 不 掩 脛
3, 此 時 與 子 空 歸 來 ， 男 呻 女 吟 四 壁 靜
3, 嗚 呼 二 歌 兮 歌 始 放 ， 鄰 里 為 我 色 惆 悵
3, 有 弟 有 弟 在 遠 方 ， 三 人 各 瘦 何 人 強
3, 生 別 輾 轉 不 相 見 ， 胡 塵 暗 天 道 路 長
3, 東 飛 鴐 鵝 後 鶖 鶬 ， 安 得 送 我 置 汝 旁
3, 有 妹 有 妹 在 鐘 離 ， 良 人 早 歿 諸 孤 癡
3, 長 淮 浪 高 蛟 龍 怒 ， 十 年 不 見 來 何 時
3, 扁 舟 欲 往 箭 滿 眼 ， 杳 杳 南 國 多 旌 旗
3, 嗚 呼 四 歌 兮 歌 四 奏 ， 林 猿 為 我 啼 清 晝
3, 四 山 多 風 溪 水 急 ， 寒 雨 颯 颯 枯 樹 濕
3, 黃 蒿 古 城 雲 不 開 ， 白 狐 跳 樑 黃 狐 立
3, 我 生 何 為 在 窮 穀 ， 中 夜 起 坐 萬 感 集
3, 嗚 呼 五 歌 兮 歌 正 長 ， 魂 招 不 來 歸 故 鄉
3, 南 有 龍 兮 在 山 湫 ， 古 木 巃 嵸 枝 相 樛
3, 我 行 怪 此 安 敢 出 ， 拔 劍 欲 斬 且 複 休
3, 嗚 呼 六 歌 兮 歌 思 遲 ， 溪 壑 為 我 回 春 姿
3, 男 兒 生 不 成 名 身 已 老 ， 三 年 饑 走 荒 山 道
3, 長 安 卿 相 多 少 年 ， 富 貴 應 須 致 身 早
3, 山 中 儒 生 舊 相 識 ， 但 話 宿 昔 傷 懷 抱
3, 嗚 呼 七 歌 兮 悄 終 曲 ， 仰 視 皇 天 白 日 速
3, 賢 有 不 黔 突 ， 聖 有 不 暖 席
3, 況 我 饑 愚 人 ， 焉 能 尚 安 宅
3, 始 來 茲 山 中 ， 休 駕 喜 地 僻
3, 忡 忡 去 絕 境 ， 杳 杳 更 遠 適
3, 停 驂 龍 潭 雲 ， 回 首 白 崖 石
3, 臨 岐 別 數 子 ， 握 手 淚 再 滴
3, 交 情 無 舊 深 ， 窮 老 多 慘 戚
3, 平 生 懶 拙 意 ， 偶 值 棲 遁 跡
3, 去 住 與 願 違 ， 仰 慚 林 間 翮
3, 首 路 栗 亭 西 ， 尚 想 鳳 凰 村
3, 季 冬 攜 童 稚 ， 辛 苦 赴 蜀 門
3, 南 登 木 皮 嶺 ， 艱 險 不 易 論
3, 遠 岫 爭 輔 佐 ， 千 岩 自 崩 奔
3, 始 知 五 嶽 外 ， 別 有 他 山 尊
3, 仰 幹 塞 大 明 ， 俯 入 裂 厚 坤
3, 再 聞 虎 豹 鬥 ， 屢 局 風 水 昏
3, 高 有 廢 閣 道 ， 摧 折 如 短 轅
3, 下 有 冬 青 林 ， 石 上 走 長 根
3, 西 崖 特 秀 髮 ， 煥 若 靈 芝 繁
3, 潤 聚 金 碧 氣 ， 清 無 沙 土 痕
3, 憶 觀 昆 侖 圖 ， 目 擊 懸 圃 存
3, 畏 途 隨 長 江 ， 渡 口 下 絕 岸
3, 差 池 上 舟 楫 ， 杳 窕 入 雲 漢
3, 天 寒 荒 野 外 ， 日 暮 中 流 半
3, 我 馬 向 北 嘶 ， 山 猿 飲 相 喚
3, 水 清 石 礧 礧 ， 沙 白 灘 漫 漫
3, 迥 然 洗 愁 辛 ， 多 病 一 疏 散
3, 高 壁 抵 嶔 崟 ， 洪 濤 越 淩 亂
3, 臨 風 獨 回 首 ， 攬 轡 複 三 歎
3, 山 行 有 常 程 ， 中 夜 尚 未 安
3, 大 江 動 我 前 ， 洶 若 溟 渤 寬
3, 篙 師 暗 理 楫 ， 歌 笑 輕 波 瀾
3, 霜 濃 木 石 滑 ， 風 急 手 足 寒
3, 入 舟 已 千 憂 ， 陟 巘 仍 萬 盤
3, 迥 眺 積 水 外 ， 始 知 眾 星 幹
3, 遠 遊 令 人 瘦 ， 衰 疾 慚 加 餐
3, 土 門 山 行 窄 ， 微 徑 緣 秋 毫
3, 棧 雲 闌 幹 峻 ， 梯 石 結 構 牢
3, 萬 壑 欹 疏 林 ， 積 陰 帶 奔 濤
3, 歇 鞍 在 地 底 ， 始 覺 所 曆 高
3, 往 來 雜 坐 臥 ， 人 馬 同 疲 勞
3, 浮 生 有 定 分 ， 饑 飽 豈 可 逃
3, 歎 息 謂 妻 子 ， 我 何 隨 汝 曹
3, 五 盤 雖 雲 險 ， 山 色 佳 有 餘
3, 仰 淩 棧 道 細 ， 俯 映 江 木 疏
3, 地 僻 無 網 罟 ， 水 清 反 多 魚
3, 好 鳥 不 妄 飛 ， 野 人 半 巢 居
3, 喜 見 淳 樸 俗 ， 坦 然 心 神 舒
3, 故 鄉 有 弟 妹 ， 流 落 隨 丘 墟
3, 成 都 萬 事 好 ， 豈 若 歸 吾 廬
3, 清 江 下 龍 門 ， 絕 壁 無 尺 土
3, 長 風 駕 高 浪 ， 浩 浩 自 太 古
3, 危 途 中 縈 盤 ， 仰 望 垂 線 縷
3, 滑 石 欹 誰 鑿 ， 浮 梁 嫋 相 拄
3, 目 眩 隕 雜 花 ， 頭 風 吹 過 雨
3, 百 年 不 敢 料 ， 一 墜 那 得 取
3, 飽 聞 經 瞿 塘 ， 足 見 度 大 庾
3, 季 冬 日 已 長 ， 山 晚 半 天 赤
3, 蜀 道 多 早 花 ， 江 間 饒 奇 石
3, 石 櫃 曾 波 上 ， 臨 虛 蕩 高 壁
3, 清 暉 回 群 鷗 ， 暝 色 帶 遠 客
3, 羈 棲 負 幽 意 ， 感 歎 向 絕 跡
3, 信 甘 孱 懦 嬰 ， 不 獨 凍 餒 迫
3, 優 遊 謝 康 樂 ， 放 浪 陶 彭 澤
3, 吾 衰 未 自 安 ， 謝 爾 性 所 適
3, 青 冥 寒 江 渡 ， 駕 竹 為 長 橋
3, 連 笮 動 嫋 娜 ， 征 衣 颯 飄 颻
3, 急 流 鴇 鷁 散 ， 絕 岸 黿 鼉 驕
3, 西 轅 自 茲 異 ， 東 逝 不 可 要
3, 高 通 荊 門 路 ， 闊 會 滄 海 潮
3, 孤 光 隱 顧 眄 ， 遊 子 悵 寂 寥
3, 無 以 洗 心 胸 ， 前 登 但 山 椒
3, 惟 天 有 設 險 ， 劍 門 天 下 壯
3, 連 山 抱 西 南 ， 石 角 皆 北 向
3, 兩 崖 崇 墉 倚 ， 刻 畫 城 郭 狀
3, 珠 玉 走 中 原 ， 岷 峨 氣 悽 愴
3, 三 皇 五 帝 前 ， 雞 犬 各 相 放
3, 後 王 尚 柔 遠 ， 職 貢 道 已 喪
3, 至 今 英 雄 人 ， 高 視 見 霸 王
3, 併 吞 與 割 據 ， 極 力 不 相 讓
3, 吾 將 罪 真 宰 ， 意 欲 鏟 疊 嶂
3, 恐 此 複 偶 然 ， 臨 風 默 惆 悵
3, 鹿 頭 何 亭 亭 ， 是 日 慰 饑 渴
3, 連 山 西 南 斷 ， 俯 見 千 里 豁
3, 及 茲 險 阻 盡 ， 始 喜 原 野 闊
3, 殊 方 昔 三 分 ， 霸 氣 曾 間 發
3, 天 下 今 一 家 ， 雲 端 失 雙 闕
3, 悠 然 想 揚 馬 ， 繼 起 名 硉 兀
3, 有 文 令 人 傷 ， 何 處 埋 爾 骨
3, 紆 餘 脂 膏 地 ， 慘 澹 豪 俠 窟
3, 仗 鉞 非 老 臣 ， 宣 風 豈 專 達
3, 冀 公 柱 石 姿 ， 論 道 邦 國 活
3, 斯 人 亦 何 幸 ， 公 鎮 逾 歲 月
3, 我 行 山 川 異 ， 忽 在 天 一 方
3, 但 逢 新 人 民 ， 未 蔔 見 故 鄉
3, 大 江 東 流 去 ， 遊 子 去 日 長
3, 曾 城 填 華 屋 ， 季 冬 樹 木 蒼
3, 喧 然 名 都 會 ， 吹 簫 間 笙 簧
3, 信 美 無 與 適 ， 側 身 望 川 梁
3, 鳥 雀 夜 各 歸 ， 中 原 杳 茫 茫
3, 初 月 出 不 高 ， 眾 星 尚 爭 光
3, 自 古 有 羈 旅 ， 我 何 苦 哀 傷
3, 古 來 相 傳 是 海 眼 ， 苔 蘚 蝕 盡 波 濤 痕
3, 雨 多 往 往 得 瑟 瑟 ， 此 事 恍 惚 難 明 論
3, 恐 是 昔 時 卿 相 墓 ， 立 石 為 表 今 仍 存
3, 惜 哉 俗 態 好 蒙 蔽 ， 亦 如 小 臣 媚 至 尊
3, 政 化 錯 迕 失 大 體 ， 坐 看 傾 危 受 厚 恩
3, 嗟 爾 石 筍 擅 虛 名 ， 後 來 未 識 猶 駿 奔
3, 安 得 壯 士 擲 天 外 ， 使 人 不 疑 見 本 根
3, 君 不 見 秦 時 蜀 太 守 ， 刻 石 立 作 三 犀 牛
3, 自 古 雖 有 厭 勝 法 ， 天 生 江 水 向 東 流
3, 今 年 灌 口 損 戶 口 ， 此 事 或 恐 為 神 羞
3, 終 藉 堤 防 出 眾 力 ， 高 擁 木 石 當 清 秋
3, 先 王 作 法 皆 正 道 ， 鬼 怪 何 得 參 人 謀
3, 嗟 爾 三 犀 不 經 濟 ， 缺 訛 只 與 長 川 逝
3, 但 見 元 氣 常 調 和 ， 自 免 洪 濤 恣 凋 瘵
3, 安 得 壯 士 提 天 綱 ， 再 平 水 土 犀 奔 茫
3, 君 不 見 昔 日 蜀 天 子 ， 化 作 杜 鵑 似 老 烏
3, 寄 巢 生 子 不 自 啄 ， 群 鳥 至 今 與 哺 雛
3, 雖 同 君 臣 有 舊 禮 ， 骨 肉 滿 眼 身 羈 孤
3, 其 聲 哀 痛 口 流 血 ， 所 訴 何 事 常 區 區
3, 爾 豈 摧 殘 始 發 憤 ， 羞 帶 羽 翮 傷 形 愚
3, 蒼 天 變 化 誰 料 得 ， 萬 事 反 復 何 所 無
3, 萬 事 反 復 何 所 無 ， 豈 憶 當 殿 群 臣 趨
3, 大 師 銅 梁 秀 ， 籍 籍 名 家 孫
3, 嗚 呼 先 博 士 ， 炳 靈 精 氣 奔
3, 惟 昔 武 皇 后 ， 臨 軒 禦 乾 坤
3, 多 士 盡 儒 冠 ， 墨 客 藹 雲 屯
3, 當 時 上 紫 殿 ， 不 獨 卿 相 尊
3, 鳳 藏 丹 霄 暮 ， 龍 去 白 水 渾
3, 青 熒 雪 嶺 東 ， 碑 碣 舊 制 存
3, 斯 文 散 都 邑 ， 高 價 越 璵 璠
3, 晚 看 作 者 意 ， 妙 絕 與 誰 論
3, 吾 祖 詩 冠 古 ， 同 年 蒙 主 恩
3, 豫 章 夾 日 月 ， 歲 久 空 深 根
3, 小 子 思 疏 闊 ， 豈 能 達 詞 門
3, 窮 愁 一 揮 淚 ， 相 遇 即 諸 昆
3, 我 住 錦 官 城 ， 兄 居 祇 樹 園
3, 天 涯 歇 滯 雨 ， 粳 稻 臥 不 翻
3, 漂 然 薄 遊 倦 ， 始 與 道 侶 敦
3, 景 晏 步 修 廊 ， 而 無 車 馬 喧
3, 夜 闌 接 軟 語 ， 落 月 如 金 盆
3, 漠 漠 世 界 黑 ， 驅 車 爭 奪 繁
3, 惟 有 摩 尼 珠 ， 可 照 濁 水 源
3, 落 景 下 高 堂 ， 進 舟 泛 回 溪
3, 誰 謂 築 居 小 ， 未 盡 喬 木 西
3, 遠 郊 信 荒 僻 ， 秋 色 有 餘 淒
3, 童 戲 左 右 岸 ， 罟 弋 畢 提 攜
3, 翻 倒 荷 芰 亂 ， 指 揮 徑 路 迷
3, 得 魚 已 割 鱗 ， 采 藕 不 洗 泥
3, 人 情 逐 鮮 美 ， 物 賤 事 已 睽
3, 吾 村 靄 暝 姿 ， 異 舍 雞 亦 棲
3, 蕭 條 欲 何 適 ， 出 處 無 可 齊
3, 衣 上 見 新 月 ， 霜 中 登 故 畦
3, 濁 醪 自 初 熟 ， 東 城 多 鼓 鼙
3, 韋 侯 別 我 有 所 適 ， 知 我 憐 君 畫 無 敵
3, 一 匹 齕 草 一 匹 嘶 ， 坐 看 千 里 當 霜 蹄
3, 時 危 安 得 真 致 此 ， 與 人 同 生 亦 同 死
3, 十 日 畫 一 水 ， 五 日 畫 一 石
3, 能 事 不 受 相 促 迫 ， 王 宰 始 肯 留 真 跡
3, 壯 哉 昆 侖 方 壺 圖 ， 掛 君 高 堂 之 素 壁
3, 巴 陵 洞 庭 日 本 東 ， 赤 岸 水 與 銀 河 通 ， 中 有 雲 氣 隨 飛 龍
3, 舟 人 漁 子 入 浦 漵 ， 山 木 盡 亞 洪 濤 風
3, 尤 工 遠 勢 古 莫 比 ， 咫 尺 應 須 論 萬 里
3, 焉 得 並 州 快 剪 刀 ， 翦 取 吳 松 半 江 水
3, 握 發 呼 兒 延 入 戶 ， 手 提 新 畫 青 松 障
3, 障 子 松 林 靜 杳 冥 ， 憑 軒 忽 若 無 丹 青
3, 陰 崖 卻 承 霜 雪 幹 ， 偃 蓋 反 走 虯 龍 形
3, 老 夫 平 生 好 奇 古 ， 對 此 興 與 精 靈 聚
3, 已 知 仙 客 意 相 親 ， 更 覺 良 工 心 獨 苦
3, 松 下 丈 人 巾 屨 同 ， 偶 坐 似 是 商 山 翁
3, 悵 望 聊 歌 紫 芝 曲 ， 時 危 慘 澹 來 悲 風
3, 天 下 幾 人 畫 古 松 ， 畢 宏 已 老 韋 偃 少
3, 絕 筆 長 風 起 纖 末 ， 滿 堂 動 色 嗟 神 妙
3, 白 摧 朽 骨 龍 虎 死 ， 黑 入 太 陰 雷 雨 垂 ， 松 根 胡 僧 憩 寂 寞 ， 龐 眉 皓 首 無 住 著
3, 偏 袒 右 肩 露 雙 腳 ， 葉 裏 松 子 僧 前 落
3, 韋 侯 韋 侯 數 相 見 ， 我 有 一 匹 好 東 絹 ， 重 之 不 減 錦 繡 段
3, 已 令 拂 拭 光 淩 亂 ， 請 公 放 筆 為 直 幹
3, 赤 縣 官 曹 擁 材 傑 ， 軟 裘 快 馬 當 冰 雪
3, 長 安 苦 寒 誰 獨 悲 ， 杜 陵 野 老 骨 欲 折
3, 南 山 豆 苗 早 荒 穢 ， 青 門 瓜 地 新 凍 裂
3, 鄉 里 兒 童 項 領 成 ， 朝 廷 故 舊 禮 數 絕
3, 自 然 棄 擲 與 時 異 ， 況 乃 疏 頑 臨 事 拙
3, 君 不 見 空 牆 日 色 晚 ， 此 老 無 聲 淚 垂 血
3, 君 不 見 徐 卿 二 子 生 絕 奇 ， 感 應 吉 夢 相 追 隨
3, 孔 子 釋 氏 親 抱 送 ， 並 是 天 上 麒 麟 兒
3, 大 兒 九 齡 色 清 澈 ， 秋 水 為 神 玉 為 骨
3, 小 兒 五 歲 氣 食 牛 ， 滿 堂 賓 客 皆 回 頭
3, 吾 知 徐 公 百 不 憂 ， 積 善 袞 袞 生 公 侯
3, 丈 夫 生 兒 有 如 此 二 雛 者 ， 名 位 豈 肯 卑 微 休
3, 有 柏 生 崇 岡 ， 童 童 狀 車 蓋
3, 偃 蹙 龍 虎 姿 ， 主 當 風 雲 會
3, 豈 知 千 年 根 ， 中 路 顏 色 壞
3, 出 非 不 得 地 ， 蟠 據 亦 高 大
3, 歲 寒 忽 無 憑 ， 日 夜 柯 葉 改
3, 丹 鳳 領 九 雛 ， 哀 鳴 翔 其 外
3, 鴟 鴞 志 意 滿 ， 養 子 穿 穴 內
3, 客 從 何 鄉 來 ， 佇 立 久 籲 怪
3, 靜 求 元 精 理 ， 浩 蕩 難 倚 賴
3, 群 橘 少 生 意 ， 雖 多 亦 奚 為
