3, 翊 戴 歸 先 主 ， 併 吞 更 出 師
3, 蟲 蛇 穿 畫 壁 ， 巫 覡 醉 蛛 絲
3, 欻 憶 吟 梁 父 ， 躬 耕 也 未 遲
3, 峽 口 大 江 間 ， 西 南 控 百 蠻
3, 城 欹 連 粉 堞 ， 岸 斷 更 青 山
3, 開 闢 多 天 險 ， 防 隅 一 水 關
3, 時 清 關 失 險 ， 世 亂 戟 如 林
3, 去 矣 英 雄 事 ， 荒 哉 割 據 心
3, 蘆 花 留 客 晚 ， 楓 樹 坐 猿 深
3, 疲 苶 煩 親 故 ， 諸 侯 數 賜 金
3, 天 池 馬 不 到 ， 嵐 壁 鳥 才 通
3, 百 頃 青 雲 杪 ， 層 波 白 石 中
3, 鬱 紆 騰 秀 氣 ， 蕭 瑟 浸 寒 空
3, 直 對 巫 山 出 ， 兼 疑 夏 禹 功
3, 魚 龍 開 闢 有 ， 菱 芡 古 今 同
3, 飄 零 神 女 雨 ， 斷 續 楚 王 風
3, 欲 問 支 機 石 ， 如 臨 獻 寶 宮
3, 九 秋 驚 雁 序 ， 萬 里 狎 漁 翁
3, 更 是 無 人 處 ， 誅 茅 任 薄 躬
3, 三 峽 傳 何 處 ， 雙 崖 壯 此 門
3, 入 天 猶 石 色 ， 穿 水 忽 雲 根
3, 猱 玃 須 髯 古 ， 蛟 龍 窟 宅 尊
3, 羲 和 冬 馭 近 ， 愁 畏 日 車 翻
3, 中 巴 之 東 巴 東 山 ， 江 水 開 闢 流 其 間
3, 白 帝 夔 州 各 異 城 ， 蜀 江 楚 峽 混 殊 名
3, 英 雄 割 據 非 天 意 ， 霸 主 併 吞 在 物 情
3, 群 雄 競 起 問 前 朝 ， 王 者 無 外 見 今 朝
3, 比 訝 漁 陽 結 怨 恨 ， 元 聽 舜 日 舊 簫 韶
3, 赤 甲 白 鹽 俱 刺 天 ， 閭 閻 繚 繞 接 山 巔
3, 楓 林 橘 樹 丹 青 合 ， 複 道 重 樓 錦 繡 懸
3, 瀼 東 瀼 西 一 萬 家 ， 江 北 江 南 春 冬 花
3, 背 飛 鶴 子 遺 瓊 蕊 ， 相 趁 鳧 雛 入 蔣 牙
3, 東 屯 稻 畦 一 百 頃 ， 北 有 澗 水 通 青 苗
3, 蜀 麻 吳 鹽 自 古 通 ， 萬 斛 之 舟 行 若 風
3, 長 年 三 老 長 歌 裏 ， 白 晝 攤 錢 高 浪 中
3, 憶 昔 咸 陽 都 市 合 ， 山 水 之 圖 張 賣 時
3, 巫 峽 曾 經 寶 屏 見 ， 楚 宮 猶 對 碧 峰 疑
3, 武 侯 祠 堂 不 可 忘 ， 中 有 松 柏 參 天 長
3, 干 戈 滿 地 客 愁 破 ， 雲 日 如 火 炎 天 涼
3, 閬 風 玄 圃 與 蓬 壺 ， 中 有 高 堂 天 下 無
3, 借 問 夔 州 壓 何 處 ， 峽 門 江 腹 擁 城 隅
3, 大 賢 為 政 即 多 聞 ， 刺 史 真 符 不 必 分
3, 文 章 千 古 事 ， 得 失 寸 心 知
3, 作 者 皆 殊 列 ， 名 聲 豈 浪 垂
3, 騷 人 嗟 不 見 ， 漢 道 盛 於 斯
3, 前 輩 飛 騰 入 ， 餘 波 綺 麗 為
3, 後 賢 兼 舊 列 ， 歷 代 各 清 規
3, 法 自 儒 家 有 ， 心 從 弱 歲 疲
3, 永 懷 江 左 逸 ， 多 病 鄴 中 奇
3, 騄 驥 皆 良 馬 ， 騏 驎 帶 好 兒
3, 車 輪 徒 已 斫 ， 堂 構 惜 仍 虧
3, 緣 情 慰 漂 蕩 ， 抱 疾 屢 遷 移
3, 經 濟 慚 長 策 ， 飛 棲 假 一 枝
3, 塵 沙 傍 蜂 蠆 ， 江 峽 繞 蛟 螭
3, 蕭 瑟 唐 虞 遠 ， 聯 翩 楚 漢 危
3, 聖 朝 兼 盜 賊 ， 異 俗 更 喧 卑
3, 鬱 鬱 星 辰 劍 ， 蒼 蒼 雲 雨 池
3, 兩 都 開 幕 府 ， 萬 宇 插 軍 麾
3, 南 海 殘 銅 柱 ， 東 風 避 月 支
3, 音 書 恨 烏 鵲 ， 號 怒 怪 熊 羆
3, 故 山 迷 白 閣 ， 秋 水 隱 黃 陂
3, 不 敢 要 佳 句 ， 愁 來 賦 別 離
3, 玉 露 凋 傷 楓 樹 林 ， 巫 山 巫 峽 氣 蕭 森
3, 江 間 波 浪 兼 天 湧 ， 塞 上 風 雲 接 地 陰
3, 叢 菊 兩 開 他 日 淚 ， 孤 舟 一 系 故 園 心
3, 寒 衣 處 處 催 刀 尺 ， 白 帝 城 高 急 暮 砧
3, 夔 府 孤 城 落 日 斜 ， 每 依 南 斗 望 京 華
3, 聽 猿 實 下 三 聲 淚 ， 奉 使 虛 隨 八 月 查
3, 畫 省 香 爐 違 伏 枕 ， 山 樓 粉 堞 隱 悲 笳
3, 千 家 山 郭 靜 朝 暉 ， 一 日 江 樓 坐 翠 微
3, 信 宿 漁 人 還 泛 泛 ， 清 秋 燕 子 故 飛 飛
3, 匡 衡 抗 疏 功 名 薄 ， 劉 向 傳 經 心 事 違
3, 同 學 少 年 多 不 賤 ， 五 陵 衣 馬 自 輕 肥
3, 聞 道 長 安 似 弈 棋 ， 百 年 世 事 不 勝 悲
3, 王 侯 第 宅 皆 新 主 ， 文 武 衣 冠 異 昔 時
3, 直 北 關 山 金 鼓 振 ， 征 西 車 馬 羽 書 遲
3, 魚 龍 寂 寞 秋 江 冷 ， 故 國 平 居 有 所 思
3, 蓬 萊 宮 闕 對 南 山 ， 承 露 金 莖 霄 漢 間
3, 雲 移 雉 尾 開 宮 扇 ， 日 繞 龍 鱗 識 聖 顏
3, 一 臥 滄 江 驚 歲 晚 ， 幾 回 青 瑣 照 朝 班
3, 瞿 唐 峽 口 曲 江 頭 ， 萬 里 風 煙 接 素 秋
3, 花 萼 夾 城 通 禦 氣 ， 芙 蓉 小 苑 入 邊 愁
3, 朱 簾 繡 柱 圍 黃 鶴 ， 錦 纜 牙 檣 起 白 鷗
3, 回 首 可 憐 歌 舞 地 ， 秦 中 自 古 帝 王 州
3, 昆 明 池 水 漢 時 功 ， 武 帝 旌 旗 在 眼 中
3, 織 女 機 絲 虛 月 夜 ， 石 鯨 鱗 甲 動 秋 風
3, 波 漂 菰 米 沈 雲 黑 ， 露 冷 蓮 房 墜 粉 紅
3, 昆 吾 禦 宿 自 逶 迤 ， 紫 閣 峰 陰 入 渼 陂
3, 香 稻 啄 餘 鸚 鵡 粒 ， 碧 梧 棲 老 鳳 凰 枝
3, 佳 人 拾 翠 春 相 問 ， 仙 侶 同 舟 晚 更 移
3, 彩 筆 昔 遊 幹 氣 象 ， 白 頭 吟 望 苦 低 垂
3, 支 離 東 北 風 塵 際 ， 漂 泊 西 南 天 地 間
3, 三 峽 樓 臺 淹 日 月 ， 五 溪 衣 服 共 雲 山
3, 羯 胡 事 主 終 無 賴 ， 詞 客 哀 時 且 未 還
3, 庾 信 平 生 最 蕭 瑟 ， 暮 年 詩 賦 動 江 關
3, 搖 落 深 知 宋 玉 悲 ， 風 流 儒 雅 亦 吾 師
3, 江 山 故 宅 空 文 藻 ， 雲 雨 荒 台 豈 夢 思
3, 最 是 楚 宮 俱 泯 滅 ， 舟 人 指 點 到 今 疑
3, 群 山 萬 壑 赴 荊 門 ， 生 長 明 妃 尚 有 村
3, 一 去 紫 台 連 朔 漠 ， 獨 留 青 塚 向 黃 昏
3, 畫 圖 省 識 春 風 面 ， 環 佩 空 歸 月 夜 魂
3, 千 載 琵 琶 作 胡 語 ， 分 明 怨 恨 曲 中 論
3, 蜀 主 窺 吳 幸 三 峽 ， 崩 年 亦 在 永 安 宮
3, 翠 華 想 像 空 山 裏 ， 玉 殿 虛 無 野 寺 中
3, 古 廟 杉 松 巢 水 鶴 ， 歲 時 伏 臘 走 村 翁
3, 諸 葛 大 名 垂 宇 宙 ， 宗 臣 遺 像 肅 清 高
3, 三 分 割 據 紆 籌 策 ， 萬 古 雲 霄 一 羽 毛
3, 伯 仲 之 間 見 伊 呂 ， 指 揮 若 定 失 蕭 曹
3, 福 移 漢 祚 難 恢 復 ， 志 決 身 殲 軍 務 勞
3, 漢 朝 陵 墓 對 南 山 ， 胡 虜 千 秋 尚 入 關
3, 昨 日 玉 魚 蒙 葬 地 ， 早 時 金 碗 出 人 間
3, 見 愁 汗 馬 西 戎 逼 ， 曾 閃 朱 旗 北 斗 殷
3, 多 少 材 官 守 涇 渭 ， 將 軍 且 莫 破 愁 顏
3, 韓 公 本 意 築 三 城 ， 擬 絕 天 驕 拔 漢 旌
3, 胡 來 不 覺 潼 關 隘 ， 龍 起 猶 聞 晉 水 清
3, 獨 使 至 尊 憂 社 稷 ， 諸 君 何 以 答 升 平
3, 洛 陽 宮 殿 化 為 烽 ， 休 道 秦 關 百 二 重
3, 滄 海 未 全 歸 禹 貢 ， 薊 門 何 處 盡 堯 封
3, 朝 廷 袞 職 雖 多 預 ， 天 下 軍 儲 不 自 供
3, 稍 喜 臨 邊 王 相 國 ， 肯 銷 金 甲 事 春 農
3, 回 首 扶 桑 銅 柱 標 ， 冥 冥 氛 祲 未 全 銷
3, 越 裳 翡 翠 無 消 息 ， 南 海 明 珠 久 寂 寥
3, 殊 錫 曾 為 大 司 馬 ， 總 戎 皆 插 侍 中 貂
3, 錦 江 春 色 逐 人 來 ， 巫 峽 清 秋 萬 壑 哀
3, 正 憶 往 時 嚴 僕 射 ， 共 迎 中 使 望 鄉 台
3, 主 恩 前 後 三 持 節 ， 軍 令 分 明 數 舉 杯
3, 西 蜀 地 形 天 下 險 ， 安 危 須 仗 出 群 材
3, 絕 塞 烏 蠻 北 ， 孤 城 白 帝 邊
3, 飄 零 仍 百 里 ， 消 渴 已 三 年
3, 雄 劍 鳴 開 匣 ， 群 書 滿 系 船
3, 亂 離 心 不 展 ， 衰 謝 日 蕭 然
3, 筋 力 妻 孥 問 ， 菁 華 歲 月 遷
3, 峽 束 滄 江 起 ， 岩 排 石 樹 圓
3, 拂 雲 霾 楚 氣 ， 朝 海 蹴 吳 天
3, 煮 井 為 鹽 速 ， 燒 畬 度 地 偏
3, 有 時 驚 疊 嶂 ， 何 處 覓 平 川
3, 鸂 鶒 雙 雙 舞 ， 獼 猿 壘 壘 懸
3, 碧 蘿 長 似 帶 ， 錦 石 小 如 錢
3, 春 草 何 曾 歇 ， 寒 花 亦 可 憐
3, 獵 人 吹 戍 火 ， 野 店 引 山 泉
3, 喚 起 搔 頭 急 ， 扶 行 幾 屐 穿
3, 幕 府 初 交 辟 ， 郎 官 幸 備 員
3, 瓜 時 猶 旅 寓 ， 萍 泛 苦 夤 緣
3, 藥 餌 虛 狼 藉 ， 秋 風 灑 靜 便
3, 開 襟 驅 瘴 癘 ， 明 目 掃 雲 煙
3, 高 宴 諸 侯 禮 ， 佳 人 上 客 前
3, 哀 箏 傷 老 大 ， 華 屋 豔 神 仙
3, 南 內 開 元 曲 ， 常 時 弟 子 傳
3, 法 歌 聲 變 轉 ， 滿 座 涕 潺 湲
3, 吊 影 夔 州 僻 ， 回 腸 杜 曲 煎
3, 耿 賈 扶 王 室 ， 蕭 曹 拱 禦 筵
3, 乘 威 滅 蜂 蠆 ， 戮 力 效 鷹 鸇
3, 舊 物 森 猶 在 ， 凶 徒 惡 未 悛
3, 國 須 行 戰 伐 ， 人 憶 止 戈 鋋
3, 奴 僕 何 知 禮 ， 恩 榮 錯 與 權
3, 胡 星 一 彗 孛 ， 黔 首 遂 拘 攣
3, 哀 痛 絲 綸 切 ， 煩 苛 法 令 蠲
3, 業 成 陳 始 王 ， 兆 喜 出 於 畋
3, 宮 禁 經 綸 密 ， 臺 階 翊 戴 全
3, 側 聽 中 興 主 ， 長 吟 不 世 賢
3, 音 徽 一 柱 數 ， 道 裏 下 牢 千
3, 鄭 李 光 時 論 ， 文 章 並 我 先
3, 陰 何 尚 清 省 ， 沈 宋 欻 聯 翩
3, 律 比 昆 侖 竹 ， 音 知 燥 濕 弦
3, 風 流 俱 善 價 ， 愜 當 久 忘 筌
3, 置 驛 常 如 此 ， 登 龍 蓋 有 焉
3, 雖 雲 隔 禮 數 ， 不 敢 墜 周 旋
3, 高 視 收 人 表 ， 虛 心 味 道 玄
3, 羽 翼 商 山 起 ， 蓬 萊 漢 閣 連
3, 管 甯 紗 帽 淨 ， 江 令 錦 袍 鮮
3, 東 郡 時 題 壁 ， 南 湖 日 扣 舷
3, 遠 遊 淩 絕 境 ， 佳 句 染 華 箋
3, 每 欲 孤 飛 去 ， 徒 為 百 慮 牽
3, 生 涯 已 寥 落 ， 國 步 乃 迍 邅
3, 衾 枕 成 蕪 沒 ， 池 塘 作 棄 捐
3, 別 離 憂 怛 怛 ， 伏 臘 涕 漣 漣
3, 露 菊 班 豐 鎬 ， 秋 蔬 影 澗 瀍
3, 富 貴 空 回 首 ， 喧 爭 懶 著 鞭
3, 兵 戈 塵 漠 漠 ， 江 漢 月 娟 娟
3, 局 促 看 秋 燕 ， 蕭 疏 聽 晚 蟬
3, 雕 蟲 蒙 記 憶 ， 烹 鯉 問 沈 綿
3, 卜 羨 君 平 杖 ， 偷 存 子 敬 氈
3, 囊 虛 把 釵 釧 ， 米 盡 坼 花 鈿
3, 甘 子 陰 涼 葉 ， 茅 齋 八 九 椽
3, 陣 圖 沙 北 岸 ， 市 暨 瀼 西 巔
3, 羈 絆 心 常 折 ， 棲 遲 病 即 痊
3, 色 好 梨 勝 頰 ， 穰 多 栗 過 拳
3, 敕 廚 唯 一 味 ， 求 飽 或 三 鱣
3, 兒 去 看 魚 笱 ， 人 來 坐 馬 韉
3, 縛 柴 門 窄 窄 ， 通 竹 溜 涓 涓
3, 塹 抵 公 畦 棱 ， 村 依 野 廟 壖
3, 缺 籬 將 棘 拒 ， 倒 石 賴 藤 纏
3, 借 問 頻 朝 謁 ， 何 如 穩 醉 眠
3, 誰 雲 行 不 逮 ， 自 覺 坐 能 堅
3, 霧 雨 銀 章 澀 ， 馨 香 粉 署 妍
3, 困 學 違 從 眾 ， 明 公 各 勉 旃
3, 聲 華 夾 宸 極 ， 早 晚 到 星 躔
3, 懇 諫 留 匡 鼎 ， 諸 儒 引 服 虔
3, 不 逢 輸 鯁 直 ， 會 是 正 陶 甄
3, 宵 旰 憂 虞 軫 ， 黎 元 疾 苦 駢
3, 雲 台 終 日 畫 ， 青 簡 為 誰 編
3, 行 路 難 何 有 ， 招 尋 興 已 專
3, 由 來 具 飛 楫 ， 暫 擬 控 鳴 弦
3, 身 許 雙 峰 寺 ， 門 求 七 祖 禪
3, 安 石 名 高 晉 ， 昭 王 客 赴 燕
3, 途 中 非 阮 籍 ， 查 上 似 張 騫
3, 披 拂 雲 寧 在 ， 淹 留 景 不 延
3, 風 期 終 破 浪 ， 水 怪 莫 飛 涎
3, 他 日 辭 神 女 ， 傷 春 怯 杜 鵑
3, 淡 交 隨 聚 散 ， 澤 國 繞 迴 旋
3, 本 自 依 迦 葉 ， 何 曾 藉 偓 佺
3, 爐 峰 生 轉 盼 ， 橘 井 尚 高 褰
3, 東 走 窮 歸 鶴 ， 南 征 盡 跕 鳶
3, 顧 凱 丹 青 列 ， 頭 陀 琬 琰 鐫
3, 眾 香 深 黯 黯 ， 幾 地 肅 芊 芊
3, 勇 猛 為 心 極 ， 清 羸 任 體 孱
3, 金 篦 空 刮 眼 ， 鏡 象 未 離 銓
3, 往 時 中 補 右 ， 扈 蹕 上 元 初
3, 反 氣 淩 行 在 ， 妖 星 下 直 廬
3, 六 龍 瞻 漢 闕 ， 萬 騎 略 姚 墟
3, 玄 朔 回 天 步 ， 神 都 憶 帝 車
3, 一 戎 才 汗 馬 ， 百 姓 免 為 魚
3, 事 殊 迎 代 邸 ， 喜 異 賞 朱 虛
3, 寇 盜 方 歸 順 ， 乾 坤 欲 晏 如
3, 不 才 同 補 袞 ， 奉 詔 許 牽 裾
3, 鴛 鷺 叨 雲 閣 ， 麒 麟 滯 玉 除
3, 文 園 多 病 後 ， 中 散 舊 交 疏
3, 飄 泊 哀 相 見 ， 平 生 意 有 餘
3, 風 煙 巫 峽 遠 ， 台 榭 楚 宮 虛
3, 觸 目 非 論 故 ， 新 文 尚 起 予
3, 清 秋 凋 碧 柳 ， 別 浦 落 紅 蕖
3, 戰 連 唇 齒 國 ， 軍 急 羽 毛 書
3, 幕 府 籌 頻 問 ， 山 家 藥 正 鋤
3, 台 星 入 朝 謁 ， 使 節 有 吹 噓
3, 西 蜀 災 長 弭 ， 南 翁 憤 始 攄
3, 對 揚 抏 士 卒 ， 幹 沒 費 倉 儲
3, 勢 藉 兵 須 用 ， 功 無 禮 忽 諸
3, 禦 鞍 金 騕 褭 ， 宮 硯 玉 蟾 蜍
3, 拜 舞 銀 鉤 落 ， 恩 波 錦 帕 舒
3, 此 行 非 不 濟 ， 良 友 昔 相 于
3, 沈 綿 疲 井 臼 ， 倚 薄 似 樵 漁
3, 乞 米 煩 佳 客 ， 鈔 詩 聽 小 胥
3, 杜 陵 斜 晚 照 ， 潏 水 帶 寒 淤
3, 莫 話 清 溪 發 ， 蕭 蕭 白 映 梳
3, 峽 內 多 雲 雨 ， 秋 來 尚 鬱 蒸
3, 遠 山 朝 白 帝 ， 深 水 謁 彝 陵
3, 遲 暮 嗟 為 客 ， 西 南 喜 得 朋
3, 哀 猿 更 起 坐 ， 落 雁 失 飛 騰
3, 伏 枕 思 瓊 樹 ， 臨 軒 對 玉 繩
3, 昔 歲 文 為 理 ， 群 公 價 盡 增
3, 家 聲 同 令 聞 ， 時 論 以 儒 稱
3, 太 后 當 朝 肅 ， 多 才 接 跡 升
3, 翠 虛 捎 魍 魎 ， 丹 極 上 鶤 鵬
3, 宴 引 春 壺 滿 ， 恩 分 夏 簟 冰
3, 雕 章 五 色 筆 ， 紫 殿 九 華 燈
3, 學 並 盧 王 敏 ， 書 偕 褚 薛 能
3, 老 兄 真 不 墜 ， 小 子 獨 無 承
3, 近 有 風 流 作 ， 聊 從 月 繼 征
3, 卷 軸 來 何 晚 ， 襟 懷 庶 可 憑
3, 會 期 吟 諷 數 ， 益 破 旅 愁 凝
3, 雕 刻 初 誰 料 ， 纖 毫 欲 自 矜
3, 神 融 躡 飛 動 ， 戰 勝 洗 侵 淩
3, 妙 取 筌 蹄 棄 ， 高 宜 百 萬 層
3, 白 頭 遺 恨 在 ， 青 竹 幾 人 登
3, 回 首 追 談 笑 ， 勞 歌 局 寢 興
3, 年 華 紛 已 矣 ， 世 故 莽 相 仍
3, 刺 史 諸 侯 貴 ， 郎 官 列 宿 應
3, 乳 r P 號 攀 石 ， 饑 鼯 訴 落 藤
3, 藥 囊 親 道 士 ， 灰 劫 問 胡 僧
3, 憑 久 烏 皮 折 ， 簪 稀 白 帽 棱
3, 林 居 看 蟻 穴 ， 野 食 行 魚 罾
3, 筋 力 交 凋 喪 ， 飄 零 免 戰 兢
3, 皆 為 百 里 宰 ， 正 似 六 安 丞
3, 姹 女 縈 新 裹 ， 丹 砂 冷 舊 秤
3, 但 求 椿 壽 永 ， 莫 慮 杞 天 崩
3, 煉 骨 調 情 性 ， 張 兵 撓 棘 矜
3, 政 術 甘 疏 誕 ， 詞 場 愧 服 膺
3, 展 懷 詩 誦 魯 ， 割 愛 酒 如 澠
3, 咄 咄 寧 書 字 ， 冥 冥 欲 避 矰
3, 江 湖 多 白 鳥 ， 天 地 有 青 蠅
3, 昔 罷 河 西 尉 ， 初 興 薊 北 師
3, 不 才 名 位 晚 ， 敢 恨 省 郎 遲
3, 扈 聖 崆 峒 日 ， 端 居 灩 澦 時
3, 萍 流 仍 汲 引 ， 樗 散 尚 恩 慈
3, 遂 阻 雲 台 宿 ， 常 懷 湛 露 詩
3, 拙 被 林 泉 滯 ， 生 逢 酒 賦 欺
3, 文 園 終 寂 寞 ， 漢 閣 自 磷 緇
3, 病 隔 君 臣 議 ， 慚 紆 德 澤 私
3, 揚 鑣 驚 主 辱 ， 拔 劍 撥 年 衰
3, 社 稷 經 綸 地 ， 風 雲 際 會 期
3, 血 流 紛 在 眼 ， 涕 灑 亂 交 頤
3, 四 瀆 樓 船 泛 ， 中 原 鼓 角 悲
3, 賊 壕 連 白 翟 ， 戰 瓦 落 丹 墀
3, 先 帝 嚴 靈 寢 ， 宗 臣 切 受 遺
3, 田 父 嗟 膠 漆 ， 行 人 避 蒺 藜
3, 總 戎 存 大 體 ， 降 將 飾 卑 詞
3, 楚 貢 何 年 絕 ， 堯 封 舊 俗 疑
3, 長 籲 翻 北 寇 ， 一 望 卷 西 夷
3, 不 必 陪 玄 圃 ， 超 然 待 具 茨
3, 凶 兵 鑄 農 器 ， 講 殿 辟 書 帷
3, 廟 算 高 難 測 ， 天 憂 實 在 茲
3, 形 容 真 潦 倒 ， 答 效 莫 支 持
3, 使 者 分 王 命 ， 群 公 各 典 司
3, 萬 里 煩 供 給 ， 孤 城 最 怨 思
3, 綠 林 寧 小 患 ， 雲 夢 欲 難 追
3, 即 事 須 嘗 膽 ， 蒼 生 可 察 眉
3, 議 堂 猶 集 鳳 ， 正 觀 是 元 龜
3, 處 處 喧 飛 檄 ， 家 家 急 競 錐
3, 蕭 車 安 不 定 ， 蜀 使 下 何 之
3, 釣 瀨 疏 墳 籍 ， 耕 岩 進 弈 棋
3, 地 蒸 餘 破 扇 ， 冬 暖 更 纖 絺
3, 豺 遘 哀 登 楚 ， 麟 傷 泣 象 尼
3, 賞 月 延 秋 桂 ， 傾 陽 逐 露 葵
3, 大 庭 終 反 樸 ， 京 觀 且 僵 屍
3, 高 枕 虛 眠 晝 ， 哀 歌 欲 和 誰
3, 南 宮 載 勳 業 ， 凡 百 慎 交 綏
3, 草 閣 柴 扉 星 散 居 ， 浪 翻 江 黑 雨 飛 初
3, 山 禽 引 子 哺 紅 果 ， 溪 友 得 錢 留 白 魚
3, 商 胡 離 別 下 揚 州 ， 憶 上 西 陵 故 驛 樓
3, 為 問 淮 南 米 貴 賤 ， 老 夫 乘 興 欲 東 流
3, 一 辭 故 國 十 經 秋 ， 每 見 秋 瓜 憶 故 丘
3, 沈 范 早 知 何 水 部 ， 曹 劉 不 待 薛 郎 中
3, 獨 當 省 署 開 文 苑 ， 兼 泛 滄 浪 學 釣 翁
3, 李 陵 蘇 武 是 吾 師 ， 孟 子 論 文 更 不 疑
3, 一 飯 未 曾 留 俗 客 ， 數 篇 今 見 古 人 詩
3, 複 憶 襄 陽 孟 浩 然 ， 清 詩 句 句 盡 堪 傳
3, 即 今 耆 舊 無 新 語 ， 漫 釣 槎 頭 縮 頸 鯿
3, 陶 冶 性 靈 在 底 物 ， 新 詩 改 罷 自 長 吟
3, 孰 知 二 謝 將 能 事 ， 頗 學 陰 何 苦 用 心
3, 不 見 高 人 王 右 丞 ， 藍 田 丘 壑 漫 寒 藤
3, 先 帝 貴 妃 今 寂 寞 ， 荔 枝 還 複 入 長 安
3, 炎 方 每 續 朱 櫻 獻 ， 玉 座 應 悲 白 露 團
3, 憶 過 瀘 戎 摘 荔 枝 ， 青 峰 隱 映 石 逶 迤
3, 京 中 舊 見 無 顏 色 ， 紅 顆 酸 甜 只 自 知
3, 翠 瓜 碧 李 沈 玉 甃 ， 赤 梨 葡 萄 寒 露 成
3, 可 憐 先 不 異 枝 蔓 ， 此 物 娟 娟 長 遠 生
3, 側 生 野 岸 及 江 蒲 ， 不 熟 丹 宮 滿 玉 壺
3, 雲 壑 布 衣 駘 背 死 ， 勞 生 重 馬 翠 眉 須
3, 人 煙 生 處 僻 ， 虎 跡 過 新 蹄
3, 釣 艇 收 緡 盡 ， 昏 鴉 接 翅 歸
3, 月 生 初 學 扇 ， 雲 細 不 成 衣
3, 萬 國 尚 防 寇 ， 故 園 今 若 何
3, 昔 歸 相 識 少 ， 早 已 戰 場 多
3, 身 覺 省 郎 在 ， 家 須 農 事 歸
3, 年 深 荒 草 徑 ， 老 恐 失 柴 扉
3, 金 絲 鏤 箭 鏃 ， 皂 尾 制 旗 竿
3, 一 自 風 塵 起 ， 猶 嗟 行 路 難
3, 胡 虜 何 曾 盛 ， 干 戈 不 肯 休
3, 貞 觀 銅 牙 弩 ， 開 元 錦 獸 張
3, 花 門 小 前 好 ， 此 物 棄 沙 場
3, 今 日 翔 麟 馬 ， 先 宜 駕 鼓 車
3, 無 勞 問 河 北 ， 諸 將 覺 榮 華
3, 任 轉 江 淮 粟 ， 休 添 苑 囿 兵
3, 由 來 貔 虎 士 ， 不 滿 鳳 凰 城
3, 江 上 亦 秋 色 ， 火 雲 終 不 移
3, 巫 山 猶 錦 樹 ， 南 國 且 黃 鸝
3, 每 恨 陶 彭 澤 ， 無 錢 對 菊 花
3, 病 減 詩 仍 拙 ， 吟 多 意 有 餘
3, 莫 看 江 總 老 ， 猶 被 賞 時 魚
3, 祿 山 作 逆 降 天 誅 ， 更 有 思 明 亦 已 無
3, 洶 洶 人 寰 猶 不 定 ， 時 時 鬥 戰 欲 何 須
3, 社 稷 蒼 生 計 必 安 ， 蠻 夷 雜 種 錯 相 干
3, 周 宣 漢 武 今 王 是 ， 孝 子 忠 臣 後 代 看
3, 喧 喧 道 路 多 歌 謠 ， 河 北 將 軍 盡 入 朝
3, 始 是 乾 坤 王 室 正 ， 卻 交 江 漢 客 魂 銷
3, 不 道 諸 公 無 表 來 ， 茫 然 庶 事 遣 人 猜
3, 鳴 玉 鏘 金 盡 正 臣 ， 修 文 偃 武 不 無 人
3, 興 王 會 靜 妖 氛 氣 ， 聖 壽 宜 過 一 萬 春
3, 英 雄 見 事 若 通 神 ， 聖 哲 為 心 小 一 身
3, 燕 趙 休 矜 出 佳 麗 ， 宮 闈 不 擬 選 才 人
3, 抱 病 江 天 白 首 郎 ， 空 山 樓 閣 暮 春 光
3, 衣 冠 是 日 朝 天 子 ， 草 奏 何 時 入 帝 鄉
3, 澶 漫 山 東 一 百 州 ， 削 成 如 桉 抱 青 丘
3, 苞 茅 重 入 歸 關 內 ， 王 祭 還 供 盡 海 頭
3, 東 逾 遼 水 北 滹 沱 ， 星 象 風 雲 喜 共 和
3, 漁 陽 突 騎 邯 鄲 兒 ， 酒 酣 並 轡 金 鞭 垂
3, 意 氣 即 歸 雙 闕 舞 ， 雄 豪 複 遣 五 陵 知
3, 李 相 將 軍 擁 薊 門 ， 白 頭 雖 老 赤 心 存
3, 竟 能 盡 說 諸 侯 入 ， 知 有 從 來 天 子 尊
3, 十 二 年 來 多 戰 場 ， 天 威 已 息 陣 堂 堂
3, 神 靈 漢 代 中 興 主 ， 功 業 汾 陽 異 姓 王
3, 蕭 關 隴 水 入 官 軍 ， 青 海 黃 河 卷 塞 雲
3, 北 極 轉 愁 龍 虎 氣 ， 西 戎 休 縱 犬 羊 群
3, 贊 普 多 教 使 入 秦 ， 數 通 和 好 止 煙 塵
3, 崆 峒 西 極 過 昆 侖 ， 駝 馬 由 來 擁 國 門
3, 逆 氣 數 年 吹 路 斷 ， 蕃 人 聞 道 漸 星 奔
3, 勃 律 天 西 采 玉 河 ， 堅 昆 碧 碗 最 來 多
3, 舊 隨 漢 使 千 堆 寶 ， 少 答 胡 王 萬 匹 羅
3, 今 春 喜 氣 滿 乾 坤 ， 南 北 東 西 拱 至 尊
3, 大 曆 二 年 調 玉 燭 ， 玄 元 皇 帝 聖 雲 孫
3, 洞 房 環 佩 冷 ， 玉 殿 起 秋 風
3, 秦 地 應 新 月 ， 龍 池 滿 舊 宮
3, 系 舟 今 夜 遠 ， 清 漏 往 時 同
3, 宿 昔 青 門 裏 ， 蓬 萊 仗 數 移
3, 花 嬌 迎 雜 樹 ， 龍 喜 出 平 池
3, 落 日 留 王 母 ， 微 風 倚 少 兒
3, 宮 中 行 樂 秘 ， 少 有 外 人 知
3, 能 畫 毛 延 壽 ， 投 壺 郭 舍 人
3, 每 蒙 天 一 笑 ， 複 似 物 皆 春
3, 政 化 平 如 水 ， 皇 恩 斷 若 神
3, 時 時 用 抵 戲 ， 亦 未 雜 風 塵
3, 鬥 雞 初 賜 錦 ， 舞 馬 既 登 床
3, 仙 遊 終 一 閟 ， 女 樂 久 無 香
3, 寂 寞 驪 山 道 ， 清 秋 草 木 黃
3, 鸚 鵡 含 愁 思 ， 聰 明 憶 別 離
3, 翠 衿 渾 短 盡 ， 紅 觜 漫 多 知
3, 未 有 開 籠 日 ， 空 殘 舊 宿 枝
3, 世 人 憐 複 損 ， 何 用 羽 毛 奇
3, 歷 歷 開 元 事 ， 分 明 在 眼 前
3, 無 端 盜 賊 起 ， 忽 已 歲 時 遷
3, 巫 峽 西 江 外 ， 秦 城 北 斗 邊
3, 洛 陽 昔 陷 沒 ， 胡 馬 犯 潼 關
3, 天 子 初 愁 思 ， 都 人 慘 別 顏
3, 清 笳 去 宮 闕 ， 翠 蓋 出 關 山
3, 故 老 仍 流 涕 ， 龍 髯 幸 再 攀
3, 驪 山 絕 望 幸 ， 花 萼 罷 登 臨
3, 地 下 無 朝 燭 ， 人 間 有 賜 金
3, 鼎 湖 龍 去 遠 ， 銀 海 雁 飛 深
3, 萬 歲 蓬 萊 日 ， 長 懸 舊 羽 林
3, 提 封 漢 天 下 ， 萬 國 尚 同 心
3, 時 征 俊 乂 入 ， 草 竊 犬 羊 侵
3, 願 戒 兵 猶 火 ， 恩 加 四 海 深
3, 巫 峽 盤 渦 曉 ， 黔 陽 貢 物 秋
3, 丹 砂 同 隕 石 ， 翠 羽 共 沉 舟
3, 羈 使 空 斜 影 ， 龍 居 閟 積 流
3, 篙 工 幸 不 溺 ， 俄 頃 逐 輕 鷗
3, 竹 宮 時 望 拜 ， 桂 館 或 求 仙
3, 姹 女 臨 波 日 ， 神 光 照 夜 年
3, 徒 聞 斬 蛟 劍 ， 無 複 爨 犀 船
3, 垂 白 馮 唐 老 ， 清 秋 宋 玉 悲
3, 江 喧 長 少 睡 ， 樓 迥 獨 移 時
3, 多 難 身 何 補 ， 無 家 病 不 辭
3, 甘 從 千 日 醉 ， 未 許 七 哀 詩
3, 草 閣 臨 無 地 ， 柴 扉 永 不 關
3, 魚 龍 回 夜 水 ， 星 月 動 秋 山
3, 久 露 清 初 濕 ， 高 雲 薄 未 還
3, 泛 舟 慚 小 婦 ， 飄 泊 損 紅 顏
3, 江 月 光 于 水 ， 高 樓 思 殺 人
3, 玉 露 團 清 影 ， 銀 河 沒 半 輪
3, 誰 家 挑 錦 字 ， 滅 燭 翠 眉 顰
3, 江 上 日 多 雨 ， 蕭 蕭 荊 楚 秋
3, 高 風 下 木 葉 ， 永 夜 攬 貂 裘
3, 勳 業 頻 看 鏡 ， 行 藏 獨 倚 樓
3, 時 危 思 報 主 ， 衰 謝 不 能 休
3, 中 夜 江 山 靜 ， 危 樓 望 北 辰
3, 長 為 萬 里 客 ， 有 愧 百 年 身
3, 故 國 風 雲 氣 ， 高 堂 戰 伐 塵
3, 江 漢 思 歸 客 ， 乾 坤 一 腐 儒
3, 片 雲 天 共 遠 ， 永 夜 月 同 孤
3, 落 日 心 猶 壯 ， 秋 風 病 欲 疏
3, 古 來 存 老 馬 ， 不 必 取 長 途
3, 白 露 團 甘 子 ， 清 晨 散 馬 蹄
3, 圃 開 連 石 樹 ， 船 渡 入 江 溪
3, 憑 幾 看 魚 樂 ， 回 鞭 急 鳥 棲
3, 漸 知 秋 實 美 ， 幽 徑 恐 多 蹊
3, 孟 氏 好 兄 弟 ， 養 親 唯 小 園
3, 負 米 力 葵 外 ， 讀 書 秋 樹 根
3, 卜 鄰 慚 近 舍 ， 訓 子 學 誰 門
3, 吾 宗 老 孫 子 ， 質 樸 古 人 風
3, 耕 鑿 安 時 論 ， 衣 冠 與 世 同
3, 在 家 常 早 起 ， 憂 國 願 年 豐
3, 語 及 君 臣 際 ， 經 書 滿 腹 中
3, 壯 心 久 零 落 ， 白 首 寄 人 間
3, 天 下 兵 常 鬥 ， 江 東 客 未 還
3, 窮 猿 號 雨 雪 ， 老 馬 怯 關 山
3, 花 葉 隨 天 意 ， 江 溪 共 石 根
3, 早 霞 隨 類 影 ， 寒 水 各 依 痕
3, 易 下 楊 朱 淚 ， 難 招 楚 客 魂
3, 風 濤 暮 不 穩 ， 舍 棹 宿 誰 門
3, 瞿 塘 夜 水 黑 ， 城 內 改 更 籌
3, 翳 翳 月 沉 霧 ， 輝 輝 星 近 樓
3, 氣 衰 甘 少 寐 ， 心 弱 恨 和 愁
3, 多 壘 滿 山 谷 ， 桃 源 無 處 求
3, 孤 月 當 樓 滿 ， 寒 江 動 夜 扉
3, 未 缺 空 山 靜 ， 高 懸 列 宿 稀
3, 故 園 松 桂 發 ， 萬 里 共 清 輝
3, 西 閣 百 尋 餘 ， 中 宵 步 綺 疏
3, 飛 星 過 水 白 ， 落 月 動 沙 虛
3, 擇 木 知 幽 鳥 ， 潛 波 想 巨 魚
3, 親 朋 滿 天 地 ， 兵 甲 少 來 書
3, 養 拙 蓬 為 戶 ， 茫 茫 何 所 開
3, 江 通 神 女 館 ， 地 隔 望 鄉 台
3, 漸 惜 容 顏 老 ， 無 由 弟 妹 來
3, 高 秋 蘇 病 氣 ， 白 髮 自 能 梳
3, 藥 餌 憎 加 減 ， 門 庭 悶 掃 除
3, 杖 藜 還 客 拜 ， 愛 竹 遣 兒 書
3, 十 月 江 平 穩 ， 輕 舟 進 所 如
3, 林 僻 來 人 少 ， 山 長 去 鳥 微
3, 高 秋 收 畫 扇 ， 久 客 掩 荊 扉
3, 懶 慢 頭 時 櫛 ， 艱 難 帶 減 圍
3, 將 軍 猶 汗 馬 ， 天 子 尚 戎 衣
3, 白 蔣 風 飆 脆 ， 殷 檉 曉 夜 稀
3, 江 濤 萬 古 峽 ， 肺 氣 久 衰 翁
3, 不 寐 防 巴 虎 ， 全 生 狎 楚 童
3, 衣 裳 垂 素 發 ， 門 巷 落 丹 楓
3, 常 怪 商 山 老 ， 兼 存 翊 贊 功
